agent_name,agent_token,agent_url,agent_type,operator_name,category,description,scanned_at
Hstspreload BOT,hstspreload-bot,https://knownagents.com/agents/hstspreload-bot,Uncategorized Agent,,uncategorized-agent,"hstspreload-bot is an uncategorized agent. If you think this is incorrect or can provide additional detail about its purpose, please let us know.",2026-04-19T23:10:27.54+00:00
HTTP Banner Detection,http-banner-detection,https://knownagents.com/agents/http-banner-detection,Uncategorized Agent,,uncategorized-agent,"HTTP Banner Detection is an uncategorized agent. If you think this is incorrect or can provide additional detail about its purpose, please let us know.",2026-04-19T23:10:27.54+00:00
Flaming Attackbot,flaming-attackbot,https://knownagents.com/agents/flaming-attackbot,Uncategorized Agent,,uncategorized-agent,"Flaming AttackBot is an uncategorized agent. If you think this is incorrect or can provide additional detail about its purpose, please let us know.",2026-04-19T23:10:27.404+00:00
Flamingo Searchengine,flamingo-searchengine,https://knownagents.com/agents/flamingo-searchengine,Uncategorized Agent,,uncategorized-agent,"Flamingo_SearchEngine is an uncategorized agent. If you think this is incorrect or can provide additional detail about its purpose, please let us know.",2026-04-19T23:10:27.404+00:00
Fleebsbot,fleebsbot,https://knownagents.com/agents/fleebsbot,Uncategorized Agent,,uncategorized-agent,"FleebsBot is an uncategorized agent operated by Fleebs. If you think this is incorrect or can provide additional detail about its purpose, please let us know.",2026-04-19T23:10:27.404+00:00
Fluffy,fluffy,https://knownagents.com/agents/fluffy,Uncategorized Agent,,uncategorized-agent,"fluffy is an uncategorized agent. If you think this is incorrect or can provide additional detail about its purpose, please let us know.",2026-04-19T23:10:27.404+00:00
Fluid,fluid,https://knownagents.com/agents/fluid,Uncategorized Agent,,uncategorized-agent,"fluid is an uncategorized agent. If you think this is incorrect or can provide additional detail about its purpose, please let us know.",2026-04-19T23:10:27.404+00:00
Flyriverbot,flyriverbot,https://knownagents.com/agents/flyriverbot,Uncategorized Agent,,uncategorized-agent,"Flyriverbot is an uncategorized agent. If you think this is incorrect or can provide additional detail about its purpose, please let us know.",2026-04-19T23:10:27.404+00:00
Foobot,foobot,https://knownagents.com/agents/foobot,Uncategorized Agent,,uncategorized-agent,"Foobot is an uncategorized agent. If you think this is incorrect or can provide additional detail about its purpose, please let us know.",2026-04-19T23:10:27.404+00:00
Fr Crawler,fr-crawler,https://knownagents.com/agents/fr-crawler,Uncategorized Agent,,uncategorized-agent,"fr-crawler is an uncategorized agent. If you think this is incorrect or can provide additional detail about its purpose, please let us know.",2026-04-19T23:10:27.404+00:00
Freewebmonitoring Sitechecker,freewebmonitoring-sitechecker,https://knownagents.com/agents/freewebmonitoring-sitechecker,Uncategorized Agent,,uncategorized-agent,"FreeWebMonitoring SiteChecker is an uncategorized agent. If you think this is incorrect or can provide additional detail about its purpose, please let us know.",2026-04-19T23:10:27.404+00:00
Freshbot,freshbot,https://knownagents.com/agents/freshbot,Uncategorized Agent,,uncategorized-agent,"Freshbot is an uncategorized agent. If you think this is incorrect or can provide additional detail about its purpose, please let us know.",2026-04-19T23:10:27.404+00:00
Freshping,freshping,https://knownagents.com/agents/freshping,Uncategorized Agent,,uncategorized-agent,"Freshping is an uncategorized agent operated by freshping. If you think this is incorrect or can provide additional detail about its purpose, please let us know.",2026-04-19T23:10:27.404+00:00
Fuelbot,fuelbot,https://knownagents.com/agents/fuelbot,Uncategorized Agent,,uncategorized-agent,"fuelbot is an uncategorized agent. If you think this is incorrect or can provide additional detail about its purpose, please let us know.",2026-04-19T23:10:27.404+00:00
Fyrebot,fyrebot,https://knownagents.com/agents/fyrebot,Uncategorized Agent,,uncategorized-agent,"Fyrebot is an uncategorized agent. If you think this is incorrect or can provide additional detail about its purpose, please let us know.",2026-04-19T23:10:27.404+00:00
G00g1e Net,g00g1e-net,https://knownagents.com/agents/g00g1e-net,Uncategorized Agent,,uncategorized-agent,"g00g1e.net is an uncategorized agent. If you think this is incorrect or can provide additional detail about its purpose, please let us know.",2026-04-19T23:10:27.404+00:00
G2 Web Services,g2-web-services,https://knownagents.com/agents/g2-web-services,Uncategorized Agent,,uncategorized-agent,"G2 Web Services is an uncategorized agent. If you think this is incorrect or can provide additional detail about its purpose, please let us know.",2026-04-19T23:10:27.404+00:00
G2reader BOT,g2reader-bot,https://knownagents.com/agents/g2reader-bot,Uncategorized Agent,,uncategorized-agent,"g2reader-bot is an uncategorized agent. If you think this is incorrect or can provide additional detail about its purpose, please let us know.",2026-04-19T23:10:27.404+00:00
Gaisbot,gaisbot,https://knownagents.com/agents/gaisbot,Uncategorized Agent,,uncategorized-agent,"Gaisbot is an uncategorized agent. If you think this is incorrect or can provide additional detail about its purpose, please let us know.",2026-04-19T23:10:27.404+00:00
Garlikcrawler,garlikcrawler,https://knownagents.com/agents/garlikcrawler,Uncategorized Agent,,uncategorized-agent,"GarlikCrawler is an uncategorized agent. If you think this is incorrect or can provide additional detail about its purpose, please let us know.",2026-04-19T23:10:27.404+00:00
Genieo,genieo,https://knownagents.com/agents/genieo,Uncategorized Agent,,uncategorized-agent,"Genieo is an uncategorized agent. If you think this is incorrect or can provide additional detail about its purpose, please let us know.",2026-04-19T23:10:27.404+00:00
Genomecrawlerd,genomecrawlerd,https://knownagents.com/agents/genomecrawlerd,Uncategorized Agent,,uncategorized-agent,"GenomeCrawlerd is an uncategorized agent operated by Nokia. If you think this is incorrect or can provide additional detail about its purpose, please let us know.",2026-04-19T23:10:27.404+00:00
Germcrawler,germcrawler,https://knownagents.com/agents/germcrawler,Uncategorized Agent,,uncategorized-agent,"GermCrawler is an uncategorized agent. If you think this is incorrect or can provide additional detail about its purpose, please let us know.",2026-04-19T23:10:27.404+00:00
Getright,getright,https://knownagents.com/agents/getright,Uncategorized Agent,,uncategorized-agent,"GetRight is an uncategorized agent. If you think this is incorrect or can provide additional detail about its purpose, please let us know.",2026-04-19T23:10:27.404+00:00
Gigablast,gigablast,https://knownagents.com/agents/gigablast,Uncategorized Agent,,uncategorized-agent,"gigablast is an uncategorized agent. If you think this is incorrect or can provide additional detail about its purpose, please let us know.",2026-04-19T23:10:27.404+00:00
Gingercrawler,gingercrawler,https://knownagents.com/agents/gingercrawler,Uncategorized Agent,,uncategorized-agent,"GingerCrawler is an uncategorized agent. If you think this is incorrect or can provide additional detail about its purpose, please let us know.",2026-04-19T23:10:27.404+00:00
Gluten Free Crawler,gluten-free-crawler,https://knownagents.com/agents/gluten-free-crawler,Uncategorized Agent,,uncategorized-agent,"Gluten Free Crawler is an uncategorized agent. If you think this is incorrect or can provide additional detail about its purpose, please let us know.",2026-04-19T23:10:27.404+00:00
Gnam Gnam Spider,gnam-gnam-spider,https://knownagents.com/agents/gnam-gnam-spider,Uncategorized Agent,,uncategorized-agent,"gnam gnam spider is an uncategorized agent. If you think this is incorrect or can provide additional detail about its purpose, please let us know.",2026-04-19T23:10:27.404+00:00
Gnowitnewsbot,gnowitnewsbot,https://knownagents.com/agents/gnowitnewsbot,Uncategorized Agent,,uncategorized-agent,"GnowitNewsbot is an uncategorized agent. If you think this is incorrect or can provide additional detail about its purpose, please let us know.",2026-04-19T23:10:27.404+00:00
Google Ads Creatives Assistant,google-ads-creatives-assistant,https://knownagents.com/agents/google-ads-creatives-assistant,Uncategorized Agent,,uncategorized-agent,"Google-Ads-Creatives-Assistant is an uncategorized agent. If you think this is incorrect or can provide additional detail about its purpose, please let us know.",2026-04-19T23:10:27.404+00:00
Google Calendar Importer,google-calendar-importer,https://knownagents.com/agents/google-calendar-importer,Uncategorized Agent,,uncategorized-agent,"Google-Calendar-Importer is an uncategorized agent. If you think this is incorrect or can provide additional detail about its purpose, please let us know.",2026-04-19T23:10:27.404+00:00
Google Certificates Bridge,google-certificates-bridge,https://knownagents.com/agents/google-certificates-bridge,Uncategorized Agent,,uncategorized-agent,"Google-Certificates-Bridge is an uncategorized agent. If you think this is incorrect or can provide additional detail about its purpose, please let us know.",2026-04-19T23:10:27.404+00:00
Google Physicalweb,google-physicalweb,https://knownagents.com/agents/google-physicalweb,Uncategorized Agent,,uncategorized-agent,"Google-PhysicalWeb is an uncategorized agent. If you think this is incorrect or can provide additional detail about its purpose, please let us know.",2026-04-19T23:10:27.404+00:00
Google Xrawler,google-xrawler,https://knownagents.com/agents/google-xrawler,Uncategorized Agent,,uncategorized-agent,"google-xrawler is an uncategorized agent. If you think this is incorrect or can provide additional detail about its purpose, please let us know.",2026-04-19T23:10:27.404+00:00
Goparserbot,goparserbot,https://knownagents.com/agents/goparserbot,Uncategorized Agent,,uncategorized-agent,"GoParserBot is an uncategorized agent. If you think this is incorrect or can provide additional detail about its purpose, please let us know.",2026-04-19T23:10:27.404+00:00
Gowikibot,gowikibot,https://knownagents.com/agents/gowikibot,Uncategorized Agent,,uncategorized-agent,"Gowikibot is an uncategorized agent. If you think this is incorrect or can provide additional detail about its purpose, please let us know.",2026-04-19T23:10:27.404+00:00
Grapeshot,grapeshot,https://knownagents.com/agents/grapeshot,Uncategorized Agent,,uncategorized-agent,"grapeshot is an uncategorized agent. If you think this is incorrect or can provide additional detail about its purpose, please let us know.",2026-04-19T23:10:27.404+00:00
Grobbot,grobbot,https://knownagents.com/agents/grobbot,Uncategorized Agent,,uncategorized-agent,"Grobbot is an uncategorized agent. If you think this is incorrect or can provide additional detail about its purpose, please let us know.",2026-04-19T23:10:27.404+00:00
Netscope Domainscanner,netscope-domainscanner,https://knownagents.com/agents/netscope-domainscanner,Uncategorized Agent,,uncategorized-agent,"NetScope-DomainScanner is an uncategorized agent. If you think this is incorrect or can provide additional detail about its purpose, please let us know.",2026-04-19T23:10:27.951+00:00
Netsystemsresearch,netsystemsresearch,https://knownagents.com/agents/netsystemsresearch,Uncategorized Agent,,uncategorized-agent,"NetSystemsResearch is an uncategorized agent. If you think this is incorrect or can provide additional detail about its purpose, please let us know.",2026-04-19T23:10:27.951+00:00
New York Times Newsgathering,new-york-times-newsgathering,https://knownagents.com/agents/new-york-times-newsgathering,Uncategorized Agent,,uncategorized-agent,"New York Times Newsgathering is an uncategorized agent operated by The New York Times. If you think this is incorrect or can provide additional detail about its purpose, please let us know.",2026-04-19T23:10:27.951+00:00
Newsai,newsai,https://knownagents.com/agents/newsai,Uncategorized Agent,,uncategorized-agent,"newsai is an uncategorized agent. If you think this is incorrect or can provide additional detail about its purpose, please let us know.",2026-04-19T23:10:27.951+00:00
Newsbot,newsbot,https://knownagents.com/agents/newsbot,Uncategorized Agent,,uncategorized-agent,"NewsBot is an uncategorized agent. If you think this is incorrect or can provide additional detail about its purpose, please let us know.",2026-04-19T23:10:27.951+00:00
Newsharecounts,newsharecounts,https://knownagents.com/agents/newsharecounts,Uncategorized Agent,,uncategorized-agent,"newsharecounts is an uncategorized agent. If you think this is incorrect or can provide additional detail about its purpose, please let us know.",2026-04-19T23:10:27.951+00:00
Newzbin,newzbin,https://knownagents.com/agents/newzbin,Uncategorized Agent,,uncategorized-agent,"Newzbin is an uncategorized agent. If you think this is incorrect or can provide additional detail about its purpose, please let us know.",2026-04-19T23:10:27.951+00:00
Nextgensearchbot,nextgensearchbot,https://knownagents.com/agents/nextgensearchbot,Uncategorized Agent,,uncategorized-agent,"NextGenSearchBot is an uncategorized agent. If you think this is incorrect or can provide additional detail about its purpose, please let us know.",2026-04-19T23:10:27.951+00:00
Nicerspro,nicerspro,https://knownagents.com/agents/nicerspro,Uncategorized Agent,,uncategorized-agent,"NICErsPRO is an uncategorized agent. If you think this is incorrect or can provide additional detail about its purpose, please let us know.",2026-04-19T23:10:27.951+00:00
Humanlinks,humanlinks,https://knownagents.com/agents/humanlinks,Uncategorized Agent,,uncategorized-agent,"humanlinks is an uncategorized agent. If you think this is incorrect or can provide additional detail about its purpose, please let us know.",2026-04-19T23:10:27.54+00:00
Hyscore,hyscore,https://knownagents.com/agents/hyscore,Uncategorized Agent,,uncategorized-agent,"HyScore is an uncategorized agent. If you think this is incorrect or can provide additional detail about its purpose, please let us know.",2026-04-19T23:10:27.54+00:00
Hyscore IO,hyscore-io,https://knownagents.com/agents/hyscore-io,Uncategorized Agent,,uncategorized-agent,"hyscore.io is an uncategorized agent. If you think this is incorrect or can provide additional detail about its purpose, please let us know.",2026-04-19T23:10:27.54+00:00
Ias Va,ias-va,https://knownagents.com/agents/ias-va,Uncategorized Agent,,uncategorized-agent,"ias-va is an uncategorized agent. If you think this is incorrect or can provide additional detail about its purpose, please let us know.",2026-04-19T23:10:27.54+00:00
Icbot,icbot,https://knownagents.com/agents/icbot,Uncategorized Agent,,uncategorized-agent,"ICBot is an uncategorized agent. If you think this is incorrect or can provide additional detail about its purpose, please let us know.",2026-04-19T23:10:27.54+00:00
Ichiro,ichiro,https://knownagents.com/agents/ichiro,Uncategorized Agent,,uncategorized-agent,"ichiro is an uncategorized agent. If you think this is incorrect or can provide additional detail about its purpose, please let us know.",2026-04-19T23:10:27.54+00:00
Impact Com Agent,impact-com-agent,https://knownagents.com/agents/impact-com-agent,Uncategorized Agent,,uncategorized-agent,"Impact.com Agent is an uncategorized agent. If you think this is incorrect or can provide additional detail about its purpose, please let us know.",2026-04-19T23:10:27.54+00:00
Imrbot,imrbot,https://knownagents.com/agents/imrbot,Uncategorized Agent,,uncategorized-agent,"imrbot is an uncategorized agent. If you think this is incorrect or can provide additional detail about its purpose, please let us know.",2026-04-19T23:10:27.54+00:00
Indeedbot,indeedbot,https://knownagents.com/agents/indeedbot,Uncategorized Agent,,uncategorized-agent,"IndeedBot is an uncategorized agent. If you think this is incorrect or can provide additional detail about its purpose, please let us know.",2026-04-19T23:10:27.54+00:00
Inetdex BOT,inetdex-bot,https://knownagents.com/agents/inetdex-bot,Uncategorized Agent,,uncategorized-agent,"INETDEX-Bot is an uncategorized agent. If you think this is incorrect or can provide additional detail about its purpose, please let us know.",2026-04-19T23:10:27.54+00:00
Infonavirobot,infonavirobot,https://knownagents.com/agents/infonavirobot,Uncategorized Agent,,uncategorized-agent,"InfoNaviRobot is an uncategorized agent. If you think this is incorrect or can provide additional detail about its purpose, please let us know.",2026-04-19T23:10:27.54+00:00
Infoobot,infoobot,https://knownagents.com/agents/infoobot,Uncategorized Agent,,uncategorized-agent,"infoobot is an uncategorized agent. If you think this is incorrect or can provide additional detail about its purpose, please let us know.",2026-04-19T23:10:27.54+00:00
Infoseek,infoseek,https://knownagents.com/agents/infoseek,Uncategorized Agent,,uncategorized-agent,"infoseek is an uncategorized agent. If you think this is incorrect or can provide additional detail about its purpose, please let us know.",2026-04-19T23:10:27.54+00:00
Integromedb,integromedb,https://knownagents.com/agents/integromedb,Uncategorized Agent,,uncategorized-agent,"integromedb is an uncategorized agent. If you think this is incorrect or can provide additional detail about its purpose, please let us know.",2026-04-19T23:10:27.54+00:00
Intelium BOT,intelium-bot,https://knownagents.com/agents/intelium-bot,Uncategorized Agent,,uncategorized-agent,"intelium_bot is an uncategorized agent. If you think this is incorrect or can provide additional detail about its purpose, please let us know.",2026-04-19T23:10:27.54+00:00
Interfaxscanbot,interfaxscanbot,https://knownagents.com/agents/interfaxscanbot,Uncategorized Agent,,uncategorized-agent,"InterfaxScanBot is an uncategorized agent. If you think this is incorrect or can provide additional detail about its purpose, please let us know.",2026-04-19T23:10:27.54+00:00
Ip Web Crawler Com,ip-web-crawler-com,https://knownagents.com/agents/ip-web-crawler-com,Uncategorized Agent,,uncategorized-agent,"ip-web-crawler.com is an uncategorized agent. If you think this is incorrect or can provide additional detail about its purpose, please let us know.",2026-04-19T23:10:27.54+00:00
Ips Agent,ips-agent,https://knownagents.com/agents/ips-agent,Uncategorized Agent,,uncategorized-agent,"ips-agent is an uncategorized agent. If you think this is incorrect or can provide additional detail about its purpose, please let us know.",2026-04-19T23:10:27.54+00:00
Irlbot,irlbot,https://knownagents.com/agents/irlbot,Uncategorized Agent,,uncategorized-agent,"IRLbot is an uncategorized agent. If you think this is incorrect or can provide additional detail about its purpose, please let us know.",2026-04-19T23:10:27.54+00:00
Iron33,iron33,https://knownagents.com/agents/iron33,Uncategorized Agent,,uncategorized-agent,"Iron33 is an uncategorized agent. If you think this is incorrect or can provide additional detail about its purpose, please let us know.",2026-04-19T23:10:27.54+00:00
Iskanie,iskanie,https://knownagents.com/agents/iskanie,Uncategorized Agent,,uncategorized-agent,"iskanie is an uncategorized agent. If you think this is incorrect or can provide additional detail about its purpose, please let us know.",2026-04-19T23:10:27.54+00:00
Israbot,israbot,https://knownagents.com/agents/israbot,Uncategorized Agent,,uncategorized-agent,"IsraBot is an uncategorized agent. If you think this is incorrect or can provide additional detail about its purpose, please let us know.",2026-04-19T23:10:27.54+00:00
Istellabot,istellabot,https://knownagents.com/agents/istellabot,Uncategorized Agent,,uncategorized-agent,"istellabot is an uncategorized agent. If you think this is incorrect or can provide additional detail about its purpose, please let us know.",2026-04-19T23:10:27.54+00:00
It2media Domain Crawler,it2media-domain-crawler,https://knownagents.com/agents/it2media-domain-crawler,Uncategorized Agent,,uncategorized-agent,"it2media-domain-crawler is an uncategorized agent. If you think this is incorrect or can provide additional detail about its purpose, please let us know.",2026-04-19T23:10:27.54+00:00
Jamesbot,jamesbot,https://knownagents.com/agents/jamesbot,Uncategorized Agent,,uncategorized-agent,"JamesBOT is an uncategorized agent. If you think this is incorrect or can provide additional detail about its purpose, please let us know.",2026-04-19T23:10:27.54+00:00
Jamies Spider,jamies-spider,https://knownagents.com/agents/jamies-spider,Uncategorized Agent,,uncategorized-agent,"Jamie's Spider is an uncategorized agent. If you think this is incorrect or can provide additional detail about its purpose, please let us know.",2026-04-19T23:10:27.54+00:00
Jenkersbot,jenkersbot,https://knownagents.com/agents/jenkersbot,Uncategorized Agent,,uncategorized-agent,"JenkersBot is an uncategorized agent. If you think this is incorrect or can provide additional detail about its purpose, please let us know.",2026-04-19T23:10:27.54+00:00
Jennybot,jennybot,https://knownagents.com/agents/jennybot,Uncategorized Agent,,uncategorized-agent,"JennyBot is an uncategorized agent. If you think this is incorrect or can provide additional detail about its purpose, please let us know.",2026-04-19T23:10:27.54+00:00
Jetbot,jetbot,https://knownagents.com/agents/jetbot,Uncategorized Agent,,uncategorized-agent,"Jetbot is an uncategorized agent. If you think this is incorrect or can provide additional detail about its purpose, please let us know.",2026-04-19T23:10:27.54+00:00
Jetty,jetty,https://knownagents.com/agents/jetty,Uncategorized Agent,,uncategorized-agent,"Jetty is an uncategorized agent. If you think this is incorrect or can provide additional detail about its purpose, please let us know.",2026-04-19T23:10:27.54+00:00
Jikespider,jikespider,https://knownagents.com/agents/jikespider,Uncategorized Agent,,uncategorized-agent,"JikeSpider is an uncategorized agent. If you think this is incorrect or can provide additional detail about its purpose, please let us know.",2026-04-19T23:10:27.54+00:00
Jobboersebot,jobboersebot,https://knownagents.com/agents/jobboersebot,Uncategorized Agent,,uncategorized-agent,"JobboerseBot is an uncategorized agent. If you think this is incorrect or can provide additional detail about its purpose, please let us know.",2026-04-19T23:10:27.54+00:00
Searchatlas,searchatlas,https://knownagents.com/agents/searchatlas,Uncategorized Agent,,uncategorized-agent,"SearchAtlas is an uncategorized agent. If you think this is incorrect or can provide additional detail about its purpose, please let us know.",2026-04-19T23:10:28.215+00:00
Searchmetricsbot,searchmetricsbot,https://knownagents.com/agents/searchmetricsbot,Uncategorized Agent,,uncategorized-agent,"SearchmetricsBot is an uncategorized agent. If you think this is incorrect or can provide additional detail about its purpose, please let us know.",2026-04-19T23:10:28.215+00:00
Searchpreview,searchpreview,https://knownagents.com/agents/searchpreview,Uncategorized Agent,,uncategorized-agent,"searchpreview is an uncategorized agent. If you think this is incorrect or can provide additional detail about its purpose, please let us know.",2026-04-19T23:10:28.215+00:00
Seekbot,seekbot,https://knownagents.com/agents/seekbot,Uncategorized Agent,,uncategorized-agent,"Seekbot is an uncategorized agent operated by Seek Bot. If you think this is incorrect or can provide additional detail about its purpose, please let us know.",2026-04-19T23:10:28.215+00:00
Seekport Crawler,seekport-crawler,https://knownagents.com/agents/seekport-crawler,Uncategorized Agent,,uncategorized-agent,"Seekport Crawler is an uncategorized agent. If you think this is incorrect or can provide additional detail about its purpose, please let us know.",2026-04-19T23:10:28.215+00:00
Seekr,seekr,https://knownagents.com/agents/seekr,Uncategorized Agent,,uncategorized-agent,"Seekr is an uncategorized agent. If you think this is incorrect or can provide additional detail about its purpose, please let us know.",2026-04-19T23:10:28.215+00:00
Seewithkids,seewithkids,https://knownagents.com/agents/seewithkids,Uncategorized Agent,,uncategorized-agent,"seewithkids is an uncategorized agent. If you think this is incorrect or can provide additional detail about its purpose, please let us know.",2026-04-19T23:10:28.215+00:00
Semantic Visions Discovery,semantic-visions-discovery,https://knownagents.com/agents/semantic-visions-discovery,Uncategorized Agent,,uncategorized-agent,"semantic-visions-discovery is an uncategorized agent. If you think this is incorrect or can provide additional detail about its purpose, please let us know.",2026-04-19T23:10:28.215+00:00
Semantic Visions Com Crawler,semantic-visions-com-crawler,https://knownagents.com/agents/semantic-visions-com-crawler,Uncategorized Agent,,uncategorized-agent,"semantic-visions.com crawler is an uncategorized agent. If you think this is incorrect or can provide additional detail about its purpose, please let us know.",2026-04-19T23:10:28.215+00:00
Semanticbot,semanticbot,https://knownagents.com/agents/semanticbot,Uncategorized Agent,,uncategorized-agent,"Semanticbot is an uncategorized agent. If you think this is incorrect or can provide additional detail about its purpose, please let us know.",2026-04-19T23:10:28.215+00:00
Sempi Tech,sempi-tech,https://knownagents.com/agents/sempi-tech,Uncategorized Agent,,uncategorized-agent,"sempi.tech is an uncategorized agent. If you think this is incorrect or can provide additional detail about its purpose, please let us know.",2026-04-19T23:10:28.215+00:00
