agent_name,agent_token,agent_url,agent_type,operator_name,category,description,scanned_at
Amazonbuyforme,amazonbuyforme,https://knownagents.com/agents/amazonbuyforme,Ai Agent,,ai-agent,AmazonBuyForMe is an Amazon bot that crawls websites as part of the Amazon Buy For Me service. This bot visits product pages and e-commerce websites to gather product information and make purchases on,2026-04-19T23:10:23.674+00:00
Chatgpt Agent,chatgpt-agent,https://knownagents.com/agents/chatgpt-agent,Ai Agent,,ai-agent,ChatGPT Agent is an AI agent created by OpenAI that can use a web browser. It can intelligently navigate and interact with websites to complete multi-step tasks on behalf of a human user.,2026-04-19T23:10:23.69+00:00
Google Agent,google-agent,https://knownagents.com/agents/google-agent,Ai Agent,,ai-agent,Google-Agent is used by agents hosted on Google infrastructure to navigate the web and perform actions upon user request.,2026-04-19T23:10:23.69+00:00
Googleagent Mariner,googleagent-mariner,https://knownagents.com/agents/googleagent-mariner,Ai Agent,,ai-agent,GoogleAgent-Mariner is an AI agent created by Google that can use a web browser. It can intelligently navigate and interact with websites to complete multi-step tasks on behalf of a human user.,2026-04-19T23:10:23.69+00:00
Manus User,manus-user,https://knownagents.com/agents/manus-user,Ai Agent,,ai-agent,"Manus-User is a browser-enabled AI agent operated by Butterfly Effect, a company based in China. It autonomously navigates websites, interprets content, and carries out multi-step tasks for human user",2026-04-19T23:10:23.69+00:00
Novaact,novaact,https://knownagents.com/agents/novaact,Ai Agent,,ai-agent,Nova Act is an AI agent created by Amazon that can use a web browser. It can intelligently navigate and interact with websites to complete multi-step tasks on behalf of a human user.,2026-04-19T23:10:23.69+00:00
Twinagent,twinagent,https://knownagents.com/agents/twinagent,Ai Agent,,ai-agent,"TwinAgent is operated by Twin, a platform that creates automated workers to perform tasks by integrating with APIs and controlling web applications through browser automation. The bot visits websites",2026-04-19T23:10:23.69+00:00
Ai2bot Deepresearcheval,ai2bot-deepresearcheval,https://knownagents.com/agents/ai2bot-deepresearcheval,Ai Assistant,,ai-assistant,"Ai2Bot-DeepResearchEval is operated by Ai2, a non-profit AI research institute. It's used to collect and scan resources used in deep research queries performed by Ai2's open source AI models.",2026-04-19T23:10:23.69+00:00
Amzn User,amzn-user,https://knownagents.com/agents/amzn-user,Ai Assistant,,ai-assistant,"Amzn-User is an AI assistant operated by Amazon, used for fetching web content to answer user queries through Alexa and other Amazon AI services.",2026-04-19T23:10:23.69+00:00
Bigsur AI,bigsur-ai,https://knownagents.com/agents/bigsur-ai,Ai Assistant,,ai-assistant,"bigsur.ai is a web crawler operated by Big Sur AI that fetches website content to enable AI-powered web agents, sales assistants, and content marketing solutions for businesses.",2026-04-19T23:10:23.69+00:00
Chatgpt User,chatgpt-user,https://knownagents.com/agents/chatgpt-user,Ai Assistant,,ai-assistant,ChatGPT-User is OpenAI's web crawler that visits websites when ChatGPT users request information. This enables ChatGPT to include links in its responses.,2026-04-19T23:10:23.69+00:00
Claude User,claude-user,https://knownagents.com/agents/claude-user,Ai Assistant,,ai-assistant,"Claude-User is dispatched by Anthropic's Claude AI assistant in response to user prompts, when it needs to fetch content to include in its answers.",2026-04-19T23:10:23.69+00:00
Duckassistbot,duckassistbot,https://knownagents.com/agents/duckassistbot,Ai Assistant,,ai-assistant,"DuckAssistBot is a web crawler that scans websites to collect content for DuckDuckGo's AI-assisted answers feature, which generates brief responses to search queries using natural language technology",2026-04-19T23:10:23.69+00:00
Gemini Deep Research,gemini-deep-research,https://knownagents.com/agents/gemini-deep-research,Ai Assistant,,ai-assistant,"Gemini-Deep-Research is the agent responsible for collecting and scanning resources used in Google Gemini's Deep Research feature, which acts as a personal research assistant.",2026-04-19T23:10:23.69+00:00
Google Notebooklm,google-notebooklm,https://knownagents.com/agents/google-notebooklm,Ai Assistant,,ai-assistant,"Google-NotebookLM is an AI-powered research and note-taking assistant that helps users synthesize information from uploaded sources like documents, transcripts, or web content. It fetches source URLs",2026-04-19T23:10:23.69+00:00
Kagi Fetcher,kagi-fetcher,https://knownagents.com/agents/kagi-fetcher,Ai Assistant,,ai-assistant,"kagi-fetcher is an AI Assistant operated by Kagi that fetches web content to answer user queries through Kagi AI, their suite of AI-powered tools including Assistant, Research, and other knowledge dis",2026-04-19T23:10:23.69+00:00
Klaviyoaibot,klaviyoaibot,https://knownagents.com/agents/klaviyoaibot,Ai Assistant,,ai-assistant,KlaviyoAIBot is Klaviyo's web crawler that fetches publicly available pages from domains explicitly connected to user accounts to power the Kai Customer Agent feature. The crawler indexes this content,2026-04-19T23:10:23.69+00:00
Linerbot,linerbot,https://knownagents.com/agents/linerbot,Ai Assistant,,ai-assistant,LinerBot is the web crawler used by Liner AI assistant to gather information from academic sources and websites to provide accurate answers with line-by-line source citations for research and scholarl,2026-04-19T23:10:23.69+00:00
Meta Externalfetcher,meta-externalfetcher,https://knownagents.com/agents/meta-externalfetcher,Ai Assistant,,ai-assistant,meta-externalfetcher is used by Meta to perform user-initiated fetches of individual links from AI assistant product functions.,2026-04-19T23:10:23.69+00:00
Mistralai User,mistralai-user,https://knownagents.com/agents/mistralai-user,Ai Assistant,,ai-assistant,"MistralAI-User is Mistral's AI assistant bot that performs web browsing and data gathering tasks for users in Le Chat, including opening web pages and retrieving information to answer user queries.",2026-04-19T23:10:23.69+00:00
Perplexity User,perplexity-user,https://knownagents.com/agents/perplexity-user,Ai Assistant,,ai-assistant,"Perplexity-User supports user actions within Perplexity. When users ask Perplexity a question, it might visit a web page to help provide an accurate answer and include a link to the page in its respon",2026-04-19T23:10:23.69+00:00
Phindbot,phindbot,https://knownagents.com/agents/phindbot,Ai Assistant,,ai-assistant,"Phind is an AI-powered answer engine designed for developers, offering technical answers and code examples. It uses real-time web search and specialized AI models to provide up-to-date, cited informat",2026-04-19T23:10:23.69+00:00
Poggio Citations,poggio-citations,https://knownagents.com/agents/poggio-citations,Ai Assistant,,ai-assistant,"Poggio-Citations is a web crawler operated by Poggio, a company that provides AI sales enablement tools for creating tailored narratives, business cases, and account plans. This bot collects informati",2026-04-19T23:10:23.69+00:00
Qualifiedbot,qualifiedbot,https://knownagents.com/agents/qualifiedbot,Ai Assistant,,ai-assistant,QualifiedBot is Qualified's web crawler that analyzes customer websites to provide contextual information for their AI-powered chatbots and conversational marketing platform.,2026-04-19T23:10:23.69+00:00
Claude Code,claude-code,https://knownagents.com/agents/claude-code,Ai Coding Agent,,ai-coding-agent,"Claude Code is an AI coding agent by Anthropic that can build, debug, and ship code directly from the terminal, handling tasks like codebase onboarding, multi-file edits, and turning issues into pull",2026-04-19T23:10:23.69+00:00
Code,code,https://knownagents.com/agents/code,Ai Coding Agent,,ai-coding-agent,"Code (GitHub Copilot) is an AI coding agent that can autonomously plan, build, and execute development tasks, functioning as a collaborative AI pair programmer.",2026-04-19T23:10:23.69+00:00
Devin,devin,https://knownagents.com/agents/devin,Ai Coding Agent,,ai-coding-agent,"Devin is a software engineering AI assistant that can browse websites and perform web-based tasks, functioning as a collaborative AI teammate for engineering teams.",2026-04-19T23:10:23.69+00:00
Google Gemini Cli,google-gemini-cli,https://knownagents.com/agents/google-gemini-cli,Ai Coding Agent,,ai-coding-agent,"Gemini CLI is an AI coding agent by Google that can query and edit large codebases, generate apps from images or PDFs, and automate complex workflows directly from the terminal.",2026-04-19T23:10:23.69+00:00
Opencode,opencode,https://knownagents.com/agents/opencode,Ai Coding Agent,,ai-coding-agent,"OpenCode is an open-source AI coding agent that helps developers write code from the terminal, IDE, or desktop, supporting multiple LLM providers and local models.",2026-04-19T23:10:23.69+00:00
Trae,trae,https://knownagents.com/agents/trae,Ai Coding Agent,,ai-coding-agent,"Trae is an AI-powered coding agent developed by ByteDance that can understand codebases, fetch web content, and generate code.",2026-04-19T23:10:23.69+00:00
Apifybot,apifybot,https://knownagents.com/agents/apifybot,Ai Data Provider,,ai-data-provider,"ApifyBot is a web scraping and data extraction crawler by Apify that collects website content for use in AI, LLMs, RAG, and automation workflows.",2026-04-19T23:10:23.69+00:00
Apifywebsitecontentcrawler,apifywebsitecontentcrawler,https://knownagents.com/agents/apifywebsitecontentcrawler,Ai Data Provider,,ai-data-provider,"ApifyWebsiteContentCrawler is a web crawler by Apify that extracts and downloads full website content for use in AI, data analysis, and automation workflows.",2026-04-19T23:10:23.69+00:00
Bravebot,bravebot,https://knownagents.com/agents/bravebot,Ai Data Provider,,ai-data-provider,"Bravebot is a web crawler by Brave that indexes pages for Brave Search, providing search data and AI-optimized context to power chatbots, agents, and RAG pipelines.",2026-04-19T23:10:23.69+00:00
Brightbot,brightbot,https://knownagents.com/agents/brightbot,Ai Data Provider,,ai-data-provider,"Brightbot is a web data collection crawler by Bright Data that extracts and structures public website content at scale, providing AI-ready data for model training, RAG pipelines, and business intellig",2026-04-19T23:10:23.69+00:00
Diffbot,diffbot,https://knownagents.com/agents/diffbot,Ai Data Provider,,ai-data-provider,"Diffbot is a web crawler that extracts and structures website content using AI-powered visual understanding, providing knowledge graph data for applications like market intelligence, e-commerce, and A",2026-04-19T23:10:23.69+00:00
Exabot,exabot,https://knownagents.com/agents/exabot,Ai Data Provider,,ai-data-provider,ExaBot is a web crawler that indexes web content to power Exa's AI search engine and semantic search APIs for AI applications.,2026-04-19T23:10:23.69+00:00
Firecrawlagent,firecrawlagent,https://knownagents.com/agents/firecrawlagent,Ai Data Provider,,ai-data-provider,FirecrawlAgent is a web crawler operated by Firecrawl that extracts web content and converts it into structured data for use in LLM and AI applications.,2026-04-19T23:10:23.69+00:00
Shapbot,shapbot,https://knownagents.com/agents/shapbot,Ai Data Provider,,ai-data-provider,"ShapBot is a web crawler by Parallel that collects and structures web content to power its search, extraction, and deep research APIs, providing AI agents with high-accuracy web context and data.",2026-04-19T23:10:23.69+00:00
Tavilybot,tavilybot,https://knownagents.com/agents/tavilybot,Ai Data Provider,,ai-data-provider,"TavilyBot is a web crawler by Tavily that indexes and extracts content from billions of pages, providing real-time search, extraction, and research data to ground AI agents with fresh web context.",2026-04-19T23:10:23.69+00:00
Youbot,youbot,https://knownagents.com/agents/youbot,Ai Data Provider,,ai-data-provider,"YouBot is a web crawler by You.com that indexes and extracts web content to power its real-time search, contents, and research APIs, delivering grounded web data to AI agents and LLMs.",2026-04-19T23:10:23.69+00:00
Ai2bot Dolma,ai2bot-dolma,https://knownagents.com/agents/ai2bot-dolma,Ai Data Scraper,,ai-data-scraper,"Ai2Bot-Dolma is operated by Ai2, a non-profit AI research institute. It's used to download data to train open source AI models.",2026-04-19T23:10:23.69+00:00
Amazonbot,amazonbot,https://knownagents.com/agents/amazonbot,Ai Data Scraper,,ai-data-scraper,"Amazonbot is a web crawler operated by Amazon that builds an index of web content to improve Amazon products and services, including Alexa, Kindle, and Amazon Shopping. The indexed content may be used",2026-04-19T23:10:23.69+00:00
Applebot Extended,applebot-extended,https://knownagents.com/agents/applebot-extended,Ai Data Scraper,,ai-data-scraper,"Apple-Extended is used to train Apple’s foundation LLM models powering generative AI features across Apple products, including Apple Intelligence, Services, and Developer Tools.",2026-04-19T23:10:23.69+00:00
Bytespider,bytespider,https://knownagents.com/agents/bytespider,Ai Data Scraper,,ai-data-scraper,"Bytespider is a web crawler operated by ByteDance, the Chinese owner of TikTok. It's allegedly used to download training data for its LLMs (Large Language Model) including those powering ChatGPT compe",2026-04-19T23:10:23.69+00:00
Ccbot,ccbot,https://knownagents.com/agents/ccbot,Ai Data Scraper,,ai-data-scraper,"CCBot is Common Crawl's web crawler that creates an open repository of web data, making crawled content universally accessible for research, analysis, and AI training purposes.",2026-04-19T23:10:23.69+00:00
Chatglm Spider,chatglm-spider,https://knownagents.com/agents/chatglm-spider,Ai Data Scraper,,ai-data-scraper,"ChatGLM-Spider is a web crawler operated by Zhipu AI, the Chinese company behind ChatGLM. It is used for collecting data to train and evaluate the company's large language models.",2026-04-19T23:10:23.69+00:00
Claudebot,claudebot,https://knownagents.com/agents/claudebot,Ai Data Scraper,,ai-data-scraper,ClaudeBot is a web crawler operated by Anthropic to download training data for its LLMs (Large Language Models) that power AI products like Claude.,2026-04-19T23:10:23.69+00:00
Cloudvertexbot,cloudvertexbot,https://knownagents.com/agents/cloudvertexbot,Ai Data Scraper,,ai-data-scraper,CloudVertexBot is a Google-operated crawler available to site owners to request targeted crawls of their own sites for AI training purposes on the Vertex AI platform.,2026-04-19T23:10:23.69+00:00
Cohere Training Data Crawler,cohere-training-data-crawler,https://knownagents.com/agents/cohere-training-data-crawler,Ai Data Scraper,,ai-data-scraper,cohere-training-data-crawler is a web crawler operated by Cohere to download training data for its LLMs (Large Language Models) that power its enterprise AI products.,2026-04-19T23:10:23.69+00:00
Cotoyogi,cotoyogi,https://knownagents.com/agents/cotoyogi,Ai Data Scraper,,ai-data-scraper,Cotoyogi is a research crawler operated by Japan's Research Organization of Information and Systems that collects web content to build AI training datasets for research purposes.,2026-04-19T23:10:23.69+00:00
Datenbank Crawler,datenbank-crawler,https://knownagents.com/agents/datenbank-crawler,Ai Data Scraper,,ai-data-scraper,Datenbank Crawler is a web crawler operated by German company netEstate used for collecting and selling international website data.,2026-04-19T23:10:24.165+00:00
Facebookbot,facebookbot,https://knownagents.com/agents/facebookbot,Ai Data Scraper,,ai-data-scraper,FacebookBot is a web crawler used by Meta to download training data for its AI speech recognition technology.,2026-04-19T23:10:24.165+00:00
Google Extended,google-extended,https://knownagents.com/agents/google-extended,Ai Data Scraper,,ai-data-scraper,Google-Extended is a web crawler used by Google to download AI training content for its AI products like the Gemini assistant and its Vertex AI generative APIs.,2026-04-19T23:10:24.165+00:00
Googleother,googleother,https://knownagents.com/agents/googleother,Ai Data Scraper,,ai-data-scraper,"GoogleOther is Google's generic crawler used by various product teams for fetching publicly accessible content, including one-off crawls for internal research and development.",2026-04-19T23:10:24.165+00:00
Gptbot,gptbot,https://knownagents.com/agents/gptbot,Ai Data Scraper,,ai-data-scraper,"GPTBot is OpenAI's web crawler that collects data from publicly accessible web pages to improve AI models like ChatGPT, while respecting robots.txt and opt-out preferences.",2026-04-19T23:10:24.165+00:00
Icc Crawler,icc-crawler,https://knownagents.com/agents/icc-crawler,Ai Data Scraper,,ai-data-scraper,ICC-Crawler is NICT's research crawler that automatically collects web pages from the Internet for academic research at Japan's National Institute of Information and Communications Technology.,2026-04-19T23:10:24.165+00:00
Imagespider,imagespider,https://knownagents.com/agents/imagespider,Ai Data Scraper,,ai-data-scraper,"imageSpider is a web crawler operated by ByteDance, the company behind TikTok, Douyin, and other content platforms. The bot collects images from websites across the internet, likely to support ByteDan",2026-04-19T23:10:24.165+00:00
Kangaroo BOT,kangaroo-bot,https://knownagents.com/agents/kangaroo-bot,Ai Data Scraper,,ai-data-scraper,Kangaroo Bot is used by the company Kangaroo LLM to download data to train open source AI models tailored to Australian language and culture.,2026-04-19T23:10:24.165+00:00
Laion Huggingface Processor,laion-huggingface-processor,https://knownagents.com/agents/laion-huggingface-processor,Ai Data Scraper,,ai-data-scraper,"LAION-huggingface-processor is a web crawler operated by LAION (Large-scale Artificial Intelligence Open Network), a non-profit organization that creates open datasets for AI research. This bot collec",2026-04-19T23:10:24.165+00:00
Lcc,lcc,https://knownagents.com/agents/lcc,Ai Data Scraper,,ai-data-scraper,LCC is a web crawler operated by the University of Leipzig that collects text data from websites to build large-scale linguistic corpora for research purposes. The bot gathers multilingual text conten,2026-04-19T23:10:24.165+00:00
Meta Externalagent,meta-externalagent,https://knownagents.com/agents/meta-externalagent,Ai Data Scraper,,ai-data-scraper,meta-externalagent crawls web content for training AI models and improving Meta's products by indexing content directly across the internet.,2026-04-19T23:10:24.165+00:00
Netestate Imprint Crawler,netestate-imprint-crawler,https://knownagents.com/agents/netestate-imprint-crawler,Ai Data Scraper,,ai-data-scraper,"netEstate Imprint Crawler is an AI data scraper operated by netEstate. If you think this is incorrect or can provide additional detail about its purpose, please let us know.",2026-04-19T23:10:24.165+00:00
Omgili,omgili,https://knownagents.com/agents/omgili,Ai Data Scraper,,ai-data-scraper,"omgili is a web crawler used by Webz.io to maintain a repository of web crawl data that it sells to other companies, including those using it to train AI models.",2026-04-19T23:10:24.165+00:00
Pangubot,pangubot,https://knownagents.com/agents/pangubot,Ai Data Scraper,,ai-data-scraper,PanguBot is a web crawler operated by the Chinese company Huawei. It's used to download training data for its multimodal LLM (Large Language Model) called PanGu.,2026-04-19T23:10:24.165+00:00
Nixstatsbot,nixstatsbot,https://knownagents.com/agents/nixstatsbot,Developer Helper,,developer-helper,"NIXStatsbot is an HTTP monitoring probe that crawls websites to check availability, performance, and uptime for the NixStats monitoring platform.",2026-04-19T23:10:24.713+00:00
Sbintuitionsbot,sbintuitionsbot,https://knownagents.com/agents/sbintuitionsbot,Ai Data Scraper,,ai-data-scraper,"SBIntuitionsBot is a web crawler operated by SB Intuitions, a Japanese company that develops generative language models optimized for the Japanese language and culture. This bot collects data from web",2026-04-19T23:10:24.165+00:00
Spider,spider,https://knownagents.com/agents/spider,Ai Data Scraper,,ai-data-scraper,"Spider is a web crawler designed for AI projects, including AI agents, LLMs, RAG systems, and data analysis. It collects and converts web data into multiple formats including markdown, HTML, and text",2026-04-19T23:10:24.165+00:00
Timpibot,timpibot,https://knownagents.com/agents/timpibot,Ai Data Scraper,,ai-data-scraper,Timpibot is used by Timpi's decentralized network of independent node operators. The index they build can be used to train LLMs (Large Language Models).,2026-04-19T23:10:24.165+00:00
Velenpublicwebcrawler,velenpublicwebcrawler,https://knownagents.com/agents/velenpublicwebcrawler,Ai Data Scraper,,ai-data-scraper,VelenPublicWebCrawler is a web crawler developed by Velen for Hunter that analyzes millions of publicly accessible internet pages every month. The bot builds business datasets and machine learning mod,2026-04-19T23:10:24.165+00:00
Webzio Extended,webzio-extended,https://knownagents.com/agents/webzio-extended,Ai Data Scraper,,ai-data-scraper,"webzio-extended is a web crawler used by Webz.io to maintain a repository of web crawl data that it sells to other companies, including those using it to train AI models.",2026-04-19T23:10:24.165+00:00
Addsearchbot,addsearchbot,https://knownagents.com/agents/addsearchbot,Ai Search Crawler,,ai-search-crawler,"AddSearchBot is a web crawler that indexes website content for AddSearch's AI-powered site search solution, collecting data to provide fast and accurate search results.",2026-04-19T23:10:24.165+00:00
Amzn Searchbot,amzn-searchbot,https://knownagents.com/agents/amzn-searchbot,Ai Search Crawler,,ai-search-crawler,Amzn-SearchBot is an AI search crawler operated by Amazon that indexes web content for use in improving Alexa and other Amazon services.,2026-04-19T23:10:24.165+00:00
Anomura,anomura,https://knownagents.com/agents/anomura,Ai Search Crawler,,ai-search-crawler,Anomura is Direqt's web crawler that discovers and indexes links and metadata from websites for inclusion in Direqt's AI search results.,2026-04-19T23:10:24.165+00:00
Applebot,applebot,https://knownagents.com/agents/applebot,Ai Search Crawler,,ai-search-crawler,"Applebot is Apple's web crawler that gathers data to power search features across Apple's ecosystem including Spotlight, Siri, and Safari search functionality.",2026-04-19T23:10:24.165+00:00
Atlassian BOT,atlassian-bot,https://knownagents.com/agents/atlassian-bot,Ai Search Crawler,,ai-search-crawler,"atlassian-bot is Atlassian's AI web crawler that indexes custom websites for Rovo, allowing the indexed content to appear in Rovo Search results and be used by Rovo Chat and Agents.",2026-04-19T23:10:24.165+00:00
Azureai Searchbot,azureai-searchbot,https://knownagents.com/agents/azureai-searchbot,Ai Search Crawler,,ai-search-crawler,AzureAI-SearchBot is an AI search crawler operated by Microsoft that indexes web content to support Azure AI services and improve search capabilities across Microsoft's AI-powered products.,2026-04-19T23:10:24.165+00:00
Channel3bot,channel3bot,https://knownagents.com/agents/channel3bot,Ai Search Crawler,,ai-search-crawler,Channel3Bot is Channel3's web crawler that visits publicly accessible product detail pages to index product information into a universal product catalog. The bot collects product details such as image,2026-04-19T23:10:24.165+00:00
Claude Searchbot,claude-searchbot,https://knownagents.com/agents/claude-searchbot,Ai Search Crawler,,ai-search-crawler,Claude-SearchBot is used to create an index of websites that can be surfaced as results in Anthropic's Claude AI assistant search feature.,2026-04-19T23:10:24.165+00:00
Cloudflare Autorag,cloudflare-autorag,https://knownagents.com/agents/cloudflare-autorag,Ai Search Crawler,,ai-search-crawler,"Cloudflare-AutoRAG is Cloudflare's web crawler that indexes websites for AI Search (formerly AutoRAG), a managed retrieval-augmented generation service. The crawler automatically ingests and continuou",2026-04-19T23:10:24.165+00:00
Google Cloudvertexbot,google-cloudvertexbot,https://knownagents.com/agents/google-cloudvertexbot,Ai Search Crawler,,ai-search-crawler,Google-CloudVertexBot is a web crawler operated by Google that collects content for Google Cloud's Vertex AI Search service. This crawler indexes web pages to power enterprise search solutions that or,2026-04-19T23:10:24.165+00:00
Linkupbot,linkupbot,https://knownagents.com/agents/linkupbot,Ai Search Crawler,,ai-search-crawler,LinkupBot is a web crawler operated by Linkup that indexes enterprise web content for its AI search platform. The bot visits websites to collect relevant business information that's used to power Link,2026-04-19T23:10:24.165+00:00
Meta Webindexer,meta-webindexer,https://knownagents.com/agents/meta-webindexer,Ai Search Crawler,,ai-search-crawler,"meta-webindexer is Meta's web crawler that browses the internet to improve search results for Meta AI users. It analyzes online content to make Meta AI's responses more relevant and accurate, allowing",2026-04-19T23:10:24.165+00:00
Oai Searchbot,oai-searchbot,https://knownagents.com/agents/oai-searchbot,Ai Search Crawler,,ai-search-crawler,"OAI-SearchBot is OpenAI's web crawler that indexes websites for SearchGPT, collecting and analyzing web content to power AI-driven search results and real-time information retrieval in OpenAI's search",2026-04-19T23:10:24.165+00:00
