agent_name,agent_token,agent_url,agent_type,operator_name,category,description,scanned_at
Nmap Scripting Engine,nmap-scripting-engine,https://knownagents.com/agents/nmap-scripting-engine,Security Scanner,,security-scanner,"Nmap Scripting Engine is a component of Nmap, a free and open source network discovery and security auditing tool. It scans networks and hosts to determine available services and system characteristic",2026-04-19T23:10:26.355+00:00
Observer,observer,https://knownagents.com/agents/observer,Security Scanner,,security-scanner,"Observer is a web security crawler that scans websites to identify third-party risks, security vulnerabilities, and performance issues. It detects compromised external resources like images, scripts,",2026-04-19T23:10:26.355+00:00
Odin,odin,https://knownagents.com/agents/odin,Security Scanner,,security-scanner,"Odin is a web crawler operated by ODIN, an internet scanning search engine platform. The bot scans websites as part of indexing operations that power searches across various datasets including hosts,",2026-04-19T23:10:26.355+00:00
Onetrust,onetrust,https://knownagents.com/agents/onetrust,Security Scanner,,security-scanner,"OneTrust is a privacy compliance crawler that scans customer websites to identify and categorize cookies, tracking technologies, forms, tags, and storage mechanisms for privacy management purposes.",2026-04-19T23:10:26.355+00:00
Projectshield Urlcheck,projectshield-urlcheck,https://knownagents.com/agents/projectshield-urlcheck,Security Scanner,,security-scanner,"ProjectShield-UrlCheck is a security scanner that monitors websites protected by Google's Project Shield service, checking for malicious traffic and DDoS attacks to ensure continuous protection.",2026-04-19T23:10:26.355+00:00
Sansec Security Monitor,sansec-security-monitor,https://knownagents.com/agents/sansec-security-monitor,Security Scanner,,security-scanner,"Sansec Security Monitor is a specialized e-commerce security scanner that monitors online stores for malware, vulnerabilities, and digital skimming attacks, providing real-time threat detection and fo",2026-04-19T23:10:26.355+00:00
Securityheaders,securityheaders,https://knownagents.com/agents/securityheaders,Security Scanner,,security-scanner,"SecurityHeaders is a free security scanning service that analyzes HTTP security headers on websites, providing grades and recommendations to improve web security posture and protect against common vul",2026-04-19T23:10:26.355+00:00
Sitelockspider,sitelockspider,https://knownagents.com/agents/sitelockspider,Security Scanner,,security-scanner,"SiteLockSpider is SiteLock's web scanning service that crawls websites to detect malware, malicious code, and security vulnerabilities for website protection.",2026-04-19T23:10:26.355+00:00
Software Security Research,software-security-research,https://knownagents.com/agents/software-security-research,Security Scanner,,security-scanner,Software Security Research is an academic research crawler operated by the Chair for Software Security at Ruhr University Bochum in Germany. This bot performs HTTP and HTTPS probes to identify website,2026-04-19T23:10:26.355+00:00
Ssl Labs,ssl-labs,https://knownagents.com/agents/ssl-labs,Security Scanner,,security-scanner,SSL Labs is Qualys' free online SSL/TLS security testing service that performs deep analysis of SSL web server configurations on the public Internet to identify security vulnerabilities and grade SSL,2026-04-19T23:10:26.355+00:00
Sucuri,sucuri,https://knownagents.com/agents/sucuri,Security Scanner,,security-scanner,"Sucuri crawls websites to detect malware, security vulnerabilities, and blacklist status as part of its cloud-based website security platform and malware removal services.",2026-04-19T23:10:26.355+00:00
Termlybot,termlybot,https://knownagents.com/agents/termlybot,Security Scanner,,security-scanner,"TermlyBot is Termly's web scanner that analyzes websites for legal compliance, privacy policy requirements, and cookie usage to ensure regulatory adherence.",2026-04-19T23:10:26.355+00:00
Twinwavescanner,twinwavescanner,https://knownagents.com/agents/twinwavescanner,Security Scanner,,security-scanner,"TwinWaveScanner (Splunk Attack Analyzer) uses headless Chrome browsers to analyze URLs for malicious content, performing automated threat analysis with comprehensive DOM, HAR, and attack chain executi",2026-04-19T23:10:26.355+00:00
Verispider,verispider,https://knownagents.com/agents/verispider,Security Scanner,,security-scanner,"Verispider is a security scanning bot that analyzes websites for spam and security threats, utilizing Project Honeypot IP intelligence for threat assessment.",2026-04-19T23:10:26.355+00:00
Visionheight Comscan,visionheight-comscan,https://knownagents.com/agents/visionheight-comscan,Security Scanner,,security-scanner,"visionheight.com/scan is a security scanner. If you think this is incorrect or can provide additional detail about its purpose, please let us know.",2026-04-19T23:10:26.355+00:00
Wtotem,wtotem,https://knownagents.com/agents/wtotem,Security Scanner,,security-scanner,"WTotem is a security monitoring bot that scans websites and web applications to detect malware, vulnerabilities, and other security threats.",2026-04-19T23:10:26.355+00:00
Wtotembot,wtotembot,https://knownagents.com/agents/wtotembot,Security Scanner,,security-scanner,"WTotemBot is a security scanner operated by WebTotem, a website security monitoring service that provides firewall protection, antivirus scanning, and vulnerability management. The bot likely visits w",2026-04-19T23:10:26.355+00:00
Aa,aa,https://knownagents.com/agents/aa,Seo Crawler,,seo-crawler,aa is a web crawler used by Agency Analytics for collecting SEO data and analyzing website performance to help marketing agencies generate client reports.,2026-04-19T23:10:26.355+00:00
Ahrefs Site Audit,ahrefs-site-audit,https://knownagents.com/agents/ahrefs-site-audit,Seo Crawler,,seo-crawler,"Ahrefs Site Audit is an SEO crawler operated by Ahrefs. If you think this is incorrect or can provide additional detail about its purpose, please let us know.",2026-04-19T23:10:26.355+00:00
Ahrefsbot,ahrefsbot,https://knownagents.com/agents/ahrefsbot,Seo Crawler,,seo-crawler,"AhrefsBot is Ahrefs' web crawler that powers both the Ahrefs marketing intelligence platform and Yep search engine, constantly crawling the web to build a comprehensive link database.",2026-04-19T23:10:26.355+00:00
Ahrefssiteaudit,ahrefssiteaudit,https://knownagents.com/agents/ahrefssiteaudit,Seo Crawler,,seo-crawler,"AhrefsSiteAudit is a technical SEO crawler that analyzes websites to identify and flag over 170 technical and on-page SEO issues, providing detailed recommendations and performance metrics for website",2026-04-19T23:10:26.355+00:00
Attracta,attracta,https://knownagents.com/agents/attracta,Seo Crawler,,seo-crawler,"Attracta is a web crawler that analyzes website content and structure to provide SEO optimization services, including link building strategies and search engine ranking improvements.",2026-04-19T23:10:26.355+00:00
Audisto Crawler,audisto-crawler,https://knownagents.com/agents/audisto-crawler,Seo Crawler,,seo-crawler,Audisto Crawler systematically fetches all accessible URLs of websites to provide comprehensive site auditing and monitoring services for SEO and technical analysis.,2026-04-19T23:10:26.355+00:00
Barkrowler,barkrowler,https://knownagents.com/agents/barkrowler,Seo Crawler,,seo-crawler,"Barkrowler is an SEO web crawler operated by Babbar that analyzes websites to identify page popularity, topical relevance, and authority metrics for search engine optimization and competitive analysis",2026-04-19T23:10:26.355+00:00
Blexbot,blexbot,https://knownagents.com/agents/blexbot,Seo Crawler,,seo-crawler,"BLEXBot is WebMeUp's web crawler that builds the world's freshest backlink index for SEO PowerSuite Link Explorer, providing comprehensive backlink data for SEO analysis tools.",2026-04-19T23:10:26.355+00:00
Botify,botify,https://knownagents.com/agents/botify,Seo Crawler,,seo-crawler,"botify's SiteCrawler analyzes website structure and content like a search engine, giving enterprise SEO teams detailed insights into how their sites are crawled and indexed.",2026-04-19T23:10:26.355+00:00
Brightedge Crawler,brightedge-crawler,https://knownagents.com/agents/brightedge-crawler,Seo Crawler,,seo-crawler,"BrightEdge Crawler powers the Autopilot SEO automation tool, crawling customer websites to analyze internal linking opportunities and identify images needing optimization for improved search engine pe",2026-04-19T23:10:26.355+00:00
Caliberbot,caliberbot,https://knownagents.com/agents/caliberbot,Seo Crawler,,seo-crawler,"CaliberBot is an SEO crawler operated by Conductor. If you think this is incorrect or can provide additional detail about its purpose, please let us know.",2026-04-19T23:10:26.355+00:00
Caliperbot,caliperbot,https://knownagents.com/agents/caliperbot,Seo Crawler,,seo-crawler,"Caliperbot is a web crawler that analyzes website content and technical features for Conductor's SEO intelligence platform, extracting HTML elements and data to power content analytics and optimizatio",2026-04-19T23:10:26.355+00:00
Claritybot,claritybot,https://knownagents.com/agents/claritybot,Seo Crawler,,seo-crawler,"ClarityBot is an SEO crawler operated by seoClarity, a search engine optimization platform. This bot crawls websites to collect data for SEO analysis and insights, helping customers monitor and improv",2026-04-19T23:10:26.355+00:00
Clearscopebot,clearscopebot,https://knownagents.com/agents/clearscopebot,Seo Crawler,,seo-crawler,"Clearscopebot crawls content for Clearscope, an AI-powered SEO content optimization platform by Mushi Labs. Analyzes top-performing content to provide keyword recommendations, content grading, and sea",2026-04-19T23:10:26.355+00:00
Cloudflare Custom Hostname Verification,cloudflare-custom-hostname-verification,https://knownagents.com/agents/cloudflare-custom-hostname-verification,Seo Crawler,,seo-crawler,"Cloudflare Custom Hostname Verification is an SEO crawler. If you think this is incorrect or can provide additional detail about its purpose, please let us know.",2026-04-19T23:10:26.355+00:00
Cloudflare Stream Webhook,cloudflare-stream-webhook,https://knownagents.com/agents/cloudflare-stream-webhook,Seo Crawler,,seo-crawler,"Cloudflare Stream Webhook is an SEO crawler. If you think this is incorrect or can provide additional detail about its purpose, please let us know.",2026-04-19T23:10:26.355+00:00
Cloudflare Healthchecks,cloudflare-healthchecks,https://knownagents.com/agents/cloudflare-healthchecks,Seo Crawler,,seo-crawler,"Cloudflare-Healthchecks is an SEO crawler. If you think this is incorrect or can provide additional detail about its purpose, please let us know.",2026-04-19T23:10:26.489+00:00
Cloudflare Prefetch,cloudflare-prefetch,https://knownagents.com/agents/cloudflare-prefetch,Seo Crawler,,seo-crawler,CloudFlare-Prefetch is a bot operated by Cloudflare that prefetches web content to improve page load times and performance for websites using Cloudflare's content delivery network and optimization ser,2026-04-19T23:10:26.489+00:00
Cloudflare Ssldetector,cloudflare-ssldetector,https://knownagents.com/agents/cloudflare-ssldetector,Seo Crawler,,seo-crawler,"Cloudflare-SSLDetector is an SEO crawler. If you think this is incorrect or can provide additional detail about its purpose, please let us know.",2026-04-19T23:10:26.489+00:00
Cloudflare Traffic Manager,cloudflare-traffic-manager,https://knownagents.com/agents/cloudflare-traffic-manager,Seo Crawler,,seo-crawler,"Cloudflare-Traffic-Manager is an SEO crawler. If you think this is incorrect or can provide additional detail about its purpose, please let us know.",2026-04-19T23:10:26.489+00:00
Cloudtrellis,cloudtrellis,https://knownagents.com/agents/cloudtrellis,Seo Crawler,,seo-crawler,"Cloudtrellis automatically scans entire websites for broken links, accessibility issues, SEO problems, and security risks to ensure optimal user experience and search engine performance.",2026-04-19T23:10:26.489+00:00
Cludo Com,cludo-com,https://knownagents.com/agents/cludo-com,Seo Crawler,,seo-crawler,"cludo.com is the web crawler bot that indexes and analyzes website content to provide AI-driven site search solutions, search analytics, and content optimization for over 1000+ websites globally.",2026-04-19T23:10:26.489+00:00
Cocolyzebot,cocolyzebot,https://knownagents.com/agents/cocolyzebot,Seo Crawler,,seo-crawler,"Cocolyzebot is an SEO crawler operated by Cocolyze, an SEO tool software company. The bot crawls websites to identify technical errors, analyze content quality and loading speeds, providing SEO insigh",2026-04-19T23:10:26.489+00:00
Cognitiveseo Crawler,cognitiveseo-crawler,https://knownagents.com/agents/cognitiveseo-crawler,Seo Crawler,,seo-crawler,"cognitiveSEO Crawler is an SEO crawler operated by cognitive SEO Internet Marketing Tools. If you think this is incorrect or can provide additional detail about its purpose, please let us know.",2026-04-19T23:10:26.489+00:00
Contentking,contentking,https://knownagents.com/agents/contentking,Seo Crawler,,seo-crawler,"contentking is a real-time SEO monitoring crawler that continuously scans websites to detect technical SEO issues, content changes, and performance problems for digital marketing teams at companies li",2026-04-19T23:10:26.489+00:00
Convermax,convermax,https://knownagents.com/agents/convermax,Seo Crawler,,seo-crawler,Convermax Site Search Indexer crawls auto parts e-commerce websites to index product data and fitment information for specialized automotive search functionality and Year-Make-Model searches.,2026-04-19T23:10:26.489+00:00
Cxense,cxense,https://knownagents.com/agents/cxense,Seo Crawler,,seo-crawler,"Cxense is an SEO crawler operated by Cxense. If you think this is incorrect or can provide additional detail about its purpose, please let us know.",2026-04-19T23:10:26.489+00:00
Dataforseo,dataforseo,https://knownagents.com/agents/dataforseo,Seo Crawler,,seo-crawler,"DataForSEO is an SEO crawler operated by DataForSEO. If you think this is incorrect or can provide additional detail about its purpose, please let us know.",2026-04-19T23:10:26.489+00:00
Dataforseo BOT,dataforseo-bot,https://knownagents.com/agents/dataforseo-bot,Seo Crawler,,seo-crawler,"DataForSEO Bot is an SEO crawler operated by DataForSEO. If you think this is incorrect or can provide additional detail about its purpose, please let us know.",2026-04-19T23:10:26.489+00:00
Dataforseobot,dataforseobot,https://knownagents.com/agents/dataforseobot,Seo Crawler,,seo-crawler,"DataForSeoBot powers DataForSEO's Backlinks API by crawling websites to analyze backlink data, providing comprehensive link analytics for SEO professionals and website optimization.",2026-04-19T23:10:26.489+00:00
Deepcrawl,deepcrawl,https://knownagents.com/agents/deepcrawl,Seo Crawler,,seo-crawler,"deepcrawl is the web crawler bot operated by Lumar, an enterprise website optimization platform. It crawls websites to collect data for technical SEO analysis, site speed monitoring, and accessibility",2026-04-19T23:10:26.489+00:00
Deepcrawl Com,deepcrawl-com,https://knownagents.com/agents/deepcrawl-com,Seo Crawler,,seo-crawler,"deepcrawl.com is Lumar's website crawler bot that analyzes customer websites to collect performance analytics, identify technical SEO issues, and provide optimization recommendations for improved sear",2026-04-19T23:10:26.489+00:00
Domainstatsbot,domainstatsbot,https://knownagents.com/agents/domainstatsbot,Seo Crawler,,seo-crawler,"DomainStatsBot is a web crawler operated by Game Lounge that collects data for Domainstats, an SEO platform providing metrics and analytics for millions of domains. The bot gathers information to comp",2026-04-19T23:10:26.489+00:00
Dotbot,dotbot,https://knownagents.com/agents/dotbot,Seo Crawler,,seo-crawler,"DotBot is Moz's web crawler that gathers web data for the Moz Link Index, providing data used in Moz Pro campaigns, Link Explorer, and the Moz Links API to analyze website backlinks and SEO metrics.",2026-04-19T23:10:26.489+00:00
Dragonbot,dragonbot,https://knownagents.com/agents/dragonbot,Seo Crawler,,seo-crawler,"Dragonbot is the web crawler operated by Dragon Metrics, an SEO software platform that provides rank tracking, competitive analysis, and site analysis services. The bot gathers data for SEO metrics in",2026-04-19T23:10:26.489+00:00
Google Digital Asset Links,google-digital-asset-links,https://knownagents.com/agents/google-digital-asset-links,Seo Crawler,,seo-crawler,"Google Digital Asset Links is an SEO crawler operated by Google. If you think this is incorrect or can provide additional detail about its purpose, please let us know.",2026-04-19T23:10:26.489+00:00
Google Storebot,google-storebot,https://knownagents.com/agents/google-storebot,Seo Crawler,,seo-crawler,"Google StoreBot is an SEO crawler operated by Google. If you think this is incorrect or can provide additional detail about its purpose, please let us know.",2026-04-19T23:10:26.489+00:00
Google Structured Data Testing,google-structured-data-testing,https://knownagents.com/agents/google-structured-data-testing,Seo Crawler,,seo-crawler,"Google-Structured-Data-Testing bot validates structured data markup on web pages, helping developers ensure proper schema implementation for rich search results and SEO optimization in Google Search.",2026-04-19T23:10:26.489+00:00
Huckabot,huckabot,https://knownagents.com/agents/huckabot,Seo Crawler,,seo-crawler,"Huckabot is Huckabuy's web crawler that indexes customer websites for dynamic rendering, page speed optimization, and SEO performance improvements through structured data enhancement.",2026-04-19T23:10:26.489+00:00
Huckabuy BOT,huckabuy-bot,https://knownagents.com/agents/huckabuy-bot,Seo Crawler,,seo-crawler,"Huckabuy Bot is an SEO crawler operated by Huckabuy. If you think this is incorrect or can provide additional detail about its purpose, please let us know.",2026-04-19T23:10:26.489+00:00
Hypestat,hypestat,https://knownagents.com/agents/hypestat,Seo Crawler,,seo-crawler,"hypestat is an SEO crawler operated by HypeStat that collects website data for analysis and statistics. The bot gathers information to generate website reports and analytics about web traffic, perform",2026-04-19T23:10:26.489+00:00
James BOT,james-bot,https://knownagents.com/agents/james-bot,Seo Crawler,,seo-crawler,"James BOT is cognitiveSEO's web crawler that analyzes website links, content, and SEO factors. It crawls websites to provide comprehensive SEO audits, backlink analysis, and site performance data for",2026-04-19T23:10:26.489+00:00
Linkcheck By Siteimprove,linkcheck-by-siteimprove,https://knownagents.com/agents/linkcheck-by-siteimprove,Seo Crawler,,seo-crawler,"LinkCheck by Siteimprove is a web crawler that analyzes websites for quality assurance, accessibility compliance, SEO optimization, and digital governance as part of Siteimprove's comprehensive conten",2026-04-19T23:10:26.489+00:00
Linkchecker BOT,linkchecker-bot,https://knownagents.com/agents/linkchecker-bot,Seo Crawler,,seo-crawler,"LinkChecker Bot is an SEO crawler operated by LinkChecker. If you think this is incorrect or can provide additional detail about its purpose, please let us know.",2026-04-19T23:10:26.489+00:00
Linkchecker Pro,linkchecker-pro,https://knownagents.com/agents/linkchecker-pro,Seo Crawler,,seo-crawler,"linkchecker.pro monitors backlink profiles daily, checking Google indexing and link status to identify broken links, manage SEO campaigns, and maintain search engine rankings through automated backlin",2026-04-19T23:10:26.489+00:00
Linkcheckerbot,linkcheckerbot,https://knownagents.com/agents/linkcheckerbot,Seo Crawler,,seo-crawler,"LinkCheckerBot is a web crawler operated by LinkChecker, a backlink monitoring and SEO tool service. The bot visits websites to verify backlink status and monitor link quality for customers tracking t",2026-04-19T23:10:26.489+00:00
Linkdexbot,linkdexbot,https://knownagents.com/agents/linkdexbot,Seo Crawler,,seo-crawler,"linkdexbot is an SEO crawler operated by Linkdex. If you think this is incorrect or can provide additional detail about its purpose, please let us know.",2026-04-19T23:10:26.489+00:00
Linksindexerbot,linksindexerbot,https://knownagents.com/agents/linksindexerbot,Seo Crawler,,seo-crawler,"LinksIndexerBot crawls websites to help ensure backlinks are discovered and indexed by search engines, improving SEO visibility through automated link submission.",2026-04-19T23:10:26.489+00:00
Marketgoo,marketgoo,https://knownagents.com/agents/marketgoo,Seo Crawler,,seo-crawler,"MarketGoo is a white-label SEO tool provider that crawls websites to analyze search engine optimization metrics, providing comprehensive SEO insights and domain intelligence for service providers and",2026-04-19T23:10:26.489+00:00
Mbcrawler,mbcrawler,https://knownagents.com/agents/mbcrawler,Seo Crawler,,seo-crawler,MBCrawler is an SEO crawler operated by SEOptimer that visits websites as part of the MonitorBacklinks service. The bot analyzes backlinks and SEO data to help website owners track their link profiles,2026-04-19T23:10:26.489+00:00
Megaindex Ru,megaindex-ru,https://knownagents.com/agents/megaindex-ru,Seo Crawler,,seo-crawler,"MegaIndex.ru is an SEO crawler operated by MegaIndex, a competitive intelligence and online marketing platform. The bot collects data for SEO analysis including link databases, backlink monitoring, an",2026-04-19T23:10:26.489+00:00
Mj12bot,mj12bot,https://knownagents.com/agents/mj12bot,Seo Crawler,,seo-crawler,"MJ12bot is Majestic's web crawler that maps link relationships between websites to build a comprehensive link graph for SEO analysis, providing backlink data and domain authority metrics without cachi",2026-04-19T23:10:26.489+00:00
Modernizebot,modernizebot,https://knownagents.com/agents/modernizebot,Seo Crawler,,seo-crawler,"ModernizeBot is a web crawler operated by ModernizeYourWebsite, a company that offers website rebuilding services for local businesses. The bot likely visits websites to analyze their current design a",2026-04-19T23:10:26.489+00:00
Moz Dotbot,moz-dotbot,https://knownagents.com/agents/moz-dotbot,Seo Crawler,,seo-crawler,"Moz dotbot is an SEO crawler operated by Moz. If you think this is incorrect or can provide additional detail about its purpose, please let us know.",2026-04-19T23:10:26.489+00:00
Moz Rogerbot,moz-rogerbot,https://knownagents.com/agents/moz-rogerbot,Seo Crawler,,seo-crawler,"Moz rogerbot is an SEO crawler operated by Moz. If you think this is incorrect or can provide additional detail about its purpose, please let us know.",2026-04-19T23:10:26.489+00:00
Nitro,nitro,https://knownagents.com/agents/nitro,Seo Crawler,,seo-crawler,Nitro- is NitroPack's web crawler that requests client websites to fetch content for their cloud-based site speed optimization solution.,2026-04-19T23:10:26.489+00:00
Nitrobot,nitrobot,https://knownagents.com/agents/nitrobot,Seo Crawler,,seo-crawler,"NitroBot is an SEO crawler operated by NitroPack. If you think this is incorrect or can provide additional detail about its purpose, please let us know.",2026-04-19T23:10:26.489+00:00
Noorobot,noorobot,https://knownagents.com/agents/noorobot,Seo Crawler,,seo-crawler,"noorobot from Noor Digital Agency periodically crawls customer websites to provide SEO recommendations, identify potential optimization issues, and enhance organic search presence.",2026-04-19T23:10:26.489+00:00
Oncrawl,oncrawl,https://knownagents.com/agents/oncrawl,Seo Crawler,,seo-crawler,"OnCrawl is an SEO crawler. If you think this is incorrect or can provide additional detail about its purpose, please let us know.",2026-04-19T23:10:26.489+00:00
Oncrawl Mobile,oncrawl-mobile,https://knownagents.com/agents/oncrawl-mobile,Seo Crawler,,seo-crawler,"OnCrawl Mobile is an SEO crawler operated by Oncrawl, a technical SEO platform. This mobile variant crawls websites to collect data and analyze site structure, performance, and other SEO-related metri",2026-04-19T23:10:26.489+00:00
Online Webceo BOT,online-webceo-bot,https://knownagents.com/agents/online-webceo-bot,Seo Crawler,,seo-crawler,"online-webceo-bot is WebCEO's crawler that audits websites for their comprehensive SEO platform, providing 24 professional tools for agency-level analysis, reports, and digital marketing insights.",2026-04-19T23:10:26.489+00:00
Prerender,prerender,https://knownagents.com/agents/prerender,Seo Crawler,,seo-crawler,Prerender is a web crawler that pre-renders Single Page Applications (SPAs) into static HTML to improve SEO visibility for JavaScript-heavy websites and search engine indexing.,2026-04-19T23:10:26.489+00:00
Pro Sitemaps,pro-sitemaps,https://knownagents.com/agents/pro-sitemaps,Seo Crawler,,seo-crawler,"Pro-Sitemaps is a web crawler that automatically scans websites to generate XML sitemaps, analyze site structure, detect broken links, and provide SEO insights for search engine optimization and websi",2026-04-19T23:10:26.489+00:00
Pro Sitemaps Generator,pro-sitemaps-generator,https://knownagents.com/agents/pro-sitemaps-generator,Seo Crawler,,seo-crawler,Pro Sitemaps Generator is a crawler that visits websites to automatically generate XML sitemaps for website owners. This service helps websites create sitemaps that can be submitted to search engines,2026-04-19T23:10:26.489+00:00
Readable,readable,https://knownagents.com/agents/readable,Seo Crawler,,seo-crawler,"Readable is a website analysis crawler that scans customers' websites to extract and analyze text content for readability, clarity, and plain language compliance, providing comprehensive content optim",2026-04-19T23:10:26.489+00:00
