agent_name,agent_token,agent_url,agent_type,operator_name,category,description,scanned_at
Iframely,iframely,https://knownagents.com/agents/iframely,Fetcher,,fetcher,"Iframely is a service that fetches URLs when users share links in apps and platforms that use Iframely as their backend. The bot extracts metadata to create rich link previews and embeds, acting on be",2026-04-19T23:10:25.182+00:00
Ifttt,ifttt,https://knownagents.com/agents/ifttt,Fetcher,,fetcher,IFTTT is an RSS feed fetcher that monitors RSS and Atom feeds to trigger automated workflows and integrations. It crawls feeds to detect new content and executes user-configured automation triggers wh,2026-04-19T23:10:25.182+00:00
Innguma Fetcher,innguma-fetcher,https://knownagents.com/agents/innguma-fetcher,Fetcher,,fetcher,"Innguma Fetcher is a fetcher operated by Innguma. If you think this is incorrect or can provide additional detail about its purpose, please let us know.",2026-04-19T23:10:25.182+00:00
Innologica,innologica,https://knownagents.com/agents/innologica,Fetcher,,fetcher,"Innologica is a fetcher operated by Innologica. If you think this is incorrect or can provide additional detail about its purpose, please let us know.",2026-04-19T23:10:25.182+00:00
Inoreader,inoreader,https://knownagents.com/agents/inoreader,Fetcher,,fetcher,"Inoreader is a cloud-based RSS feed reader service that fetches RSS feeds on behalf of users who subscribe to them. The bot periodically checks for new content and distributes it to subscribers, with",2026-04-19T23:10:25.182+00:00
Inoreader Com,inoreader-com,https://knownagents.com/agents/inoreader-com,Fetcher,,fetcher,"inoreader.com is the web crawler for Inoreader, a popular RSS feed reader used by over a million people. It fetches content from RSS feeds, social media, and websites to build personalized newsfeeds.",2026-04-19T23:10:25.182+00:00
Instapaper,instapaper,https://knownagents.com/agents/instapaper,Fetcher,,fetcher,Instapaper is a content fetcher that crawls and downloads web articles to make them available for offline reading. It processes and parses web pages to extract readable text content for the Instapaper,2026-04-19T23:10:25.182+00:00
Instaparser,instaparser,https://knownagents.com/agents/instaparser,Fetcher,,fetcher,"Instaparser is the web crawler for Instapaper, a read-it-later service that allows users to save web articles for offline reading. This bot visits websites to fetch and parse article content when user",2026-04-19T23:10:25.182+00:00
Linkedinbot,linkedinbot,https://knownagents.com/agents/linkedinbot,Fetcher,,fetcher,"LinkedInBot is LinkedIn's web crawler that fetches webpage content to generate link previews and rich cards when URLs are shared on the LinkedIn platform, extracting Open Graph metadata and images for",2026-04-19T23:10:25.182+00:00
Lmarenaunfurlbot,lmarenaunfurlbot,https://knownagents.com/agents/lmarenaunfurlbot,Fetcher,,fetcher,"LMArenaUnfurlBot is a fetcher. If you think this is incorrect or can provide additional detail about its purpose, please let us know.",2026-04-19T23:10:25.182+00:00
Loomlybot,loomlybot,https://knownagents.com/agents/loomlybot,Fetcher,,fetcher,LoomlyBot is a metadata extraction bot used by Loomly's social media management platform to fetch web page metadata and generate social media post previews. This allows users to see how their shared l,2026-04-19T23:10:25.182+00:00
Magnet Me Web,magnet-me-web,https://knownagents.com/agents/magnet-me-web,Fetcher,,fetcher,Magnet.me-web crawler monitors customer company websites to automatically synchronize and update job opening listings for the Magnet.me recruitment platform. This bot ensures job listings remain curre,2026-04-19T23:10:25.182+00:00
Magpierss,magpierss,https://knownagents.com/agents/magpierss,Fetcher,,fetcher,"MagpieRSS is an RSS feed parser written in PHP that fetches and parses RSS and Atom feeds. This bot visits websites to retrieve RSS feed content, parsing feeds from RSS 0.9 through RSS 2.0 and Atom fo",2026-04-19T23:10:25.182+00:00
Mail Ru BOT,mail-ru-bot,https://knownagents.com/agents/mail-ru-bot,Fetcher,,fetcher,Mail.RU_Bot fetches web content and metadata for email previews and link processing on behalf of the Mail.ru email service. The bot serves Russian users by providing rich link previews in their email,2026-04-19T23:10:25.182+00:00
Mailchimp,mailchimp,https://knownagents.com/agents/mailchimp,Fetcher,,fetcher,MailChimp is a bot associated with the Mailchimp email marketing and automation platform. This bot fetches web content that may be linked to or referenced within email campaigns created by Mailchimp u,2026-04-19T23:10:25.182+00:00
Mailrubot,mailrubot,https://knownagents.com/agents/mailrubot,Fetcher,,fetcher,"MailRUBot is a fetcher operated by Mail Russia. If you think this is incorrect or can provide additional detail about its purpose, please let us know.",2026-04-19T23:10:25.182+00:00
Mastodon,mastodon,https://knownagents.com/agents/mastodon,Fetcher,,fetcher,"Mastodon is a fetcher operated by Mastodon. If you think this is incorrect or can provide additional detail about its purpose, please let us know.",2026-04-19T23:10:25.182+00:00
Mediumbot Metatagfetcher,mediumbot-metatagfetcher,https://knownagents.com/agents/mediumbot-metatagfetcher,Fetcher,,fetcher,"Mediumbot-MetaTagFetcher is a bot operated by Medium, an online publishing platform, that fetches meta tag information from web pages. This bot likely visits websites to extract preview information su",2026-04-19T23:10:25.182+00:00
Microsoft Preview,microsoft-preview,https://knownagents.com/agents/microsoft-preview,Fetcher,,fetcher,"Microsoft Preview is a fetcher operated by Microsoft. If you think this is incorrect or can provide additional detail about its purpose, please let us know.",2026-04-19T23:10:25.182+00:00
Microsoftpreview,microsoftpreview,https://knownagents.com/agents/microsoftpreview,Fetcher,,fetcher,"MicrosoftPreview is a web crawler that generates page snapshots and link previews for Microsoft products and services, extracting metadata and visual content to create rich previews in applications.",2026-04-19T23:10:25.182+00:00
Miniflux,miniflux,https://knownagents.com/agents/miniflux,Fetcher,,fetcher,Miniflux is a minimalist feed reader application that fetches RSS and web feeds to aggregate content for its users. This bot retrieves feed content and updates on behalf of Miniflux users to display a,2026-04-19T23:10:25.182+00:00
Missinglettrbot,missinglettrbot,https://knownagents.com/agents/missinglettrbot,Fetcher,,fetcher,MissinglettrBot is a web crawler that automatically detects and fetches blog post content from customer websites to create automated social media drip campaigns and marketing content.,2026-04-19T23:10:25.182+00:00
Muckrackfeedparser,muckrackfeedparser,https://knownagents.com/agents/muckrackfeedparser,Fetcher,,fetcher,"MuckRackFeedParser is a feed parsing bot operated by Muck Rack, a platform that connects journalists with public relations professionals. This bot fetches and parses RSS feeds from news sites and blog",2026-04-19T23:10:25.182+00:00
Newsblur,newsblur,https://knownagents.com/agents/newsblur,Fetcher,,fetcher,"NewsBlur is a web crawler that fetches RSS feeds and web content for its personal news reader service, collecting articles from subscribed websites and blogs to deliver real-time updates to users' new",2026-04-19T23:10:25.182+00:00
Newsblur Feed Fetcher,newsblur-feed-fetcher,https://knownagents.com/agents/newsblur-feed-fetcher,Fetcher,,fetcher,"NewsBlur Feed Fetcher is the bot used by NewsBlur, an RSS feed reader service, to retrieve and update content from RSS and Atom feeds that users have subscribed to. The bot visits websites to fetch ne",2026-04-19T23:10:25.182+00:00
Newsblur Page Fetcher,newsblur-page-fetcher,https://knownagents.com/agents/newsblur-page-fetcher,Fetcher,,fetcher,"NewsBlur Page Fetcher is a bot operated by NewsBlur, an RSS feed reader and news aggregation service. It fetches content from websites on behalf of subscribers, with the user agent number indicating h",2026-04-19T23:10:25.182+00:00
Nextcloud,nextcloud,https://knownagents.com/agents/nextcloud,Fetcher,,fetcher,"NextCloud is a fetcher operated by Nextcloud. If you think this is incorrect or can provide additional detail about its purpose, please let us know.",2026-04-19T23:10:25.182+00:00
Nooshub,nooshub,https://knownagents.com/agents/nooshub,Fetcher,,fetcher,"Nooshub is a modern RSS reader bot that fetches RSS and Atom feeds and uses learning algorithms to group similar articles, remove clutter, and identify trending topics. It provides an organized approa",2026-04-19T23:10:25.182+00:00
Buck,buck,https://knownagents.com/agents/buck,Intelligence Gatherer,,intelligence-gatherer,"Buck is a web crawler operated by Hypefactors, a unified PR software platform that provides media monitoring and analytics services. The bot collects media coverage data to help PR professionals track",2026-04-19T23:10:25.624+00:00
Channable,channable,https://knownagents.com/agents/channable,Intelligence Gatherer,,intelligence-gatherer,"channable bot automates multichannel e-commerce marketing by crawling product data from webshops to optimize feeds, listings, and advertising campaigns across 3000+ platforms.",2026-04-19T23:10:25.624+00:00
Checkmarknetwork,checkmarknetwork,https://knownagents.com/agents/checkmarknetwork,Intelligence Gatherer,,intelligence-gatherer,"CheckMarkNetwork is a web crawler operated by CheckMark Network, a brand protection and trademark monitoring company. The bot crawls websites to help clients track their brands online and identify pot",2026-04-19T23:10:25.624+00:00
Cincraw,cincraw,https://knownagents.com/agents/cincraw,Intelligence Gatherer,,intelligence-gatherer,"Cincraw is an intelligence gatherer operated by CINC. If you think this is incorrect or can provide additional detail about its purpose, please let us know.",2026-04-19T23:10:25.624+00:00
Clickagy Intelligence BOT,clickagy-intelligence-bot,https://knownagents.com/agents/clickagy-intelligence-bot,Intelligence Gatherer,,intelligence-gatherer,"Clickagy Intelligence Bot is a web crawler operated by Clickagy, a company that gathers intelligence and data from websites. This bot is classified as an Intelligence Gatherer and likely collects info",2026-04-19T23:10:25.624+00:00
Clickagy Intelligence BOT V2,clickagy-intelligence-bot-v2,https://knownagents.com/agents/clickagy-intelligence-bot-v2,Intelligence Gatherer,,intelligence-gatherer,"Clickagy Intelligence Bot v2 performs advanced ad verification, privacy compliance tracking, and digital advertising intelligence gathering across websites for market analysis and optimization.",2026-04-19T23:10:25.624+00:00
Contextualbot,contextualbot,https://knownagents.com/agents/contextualbot,Intelligence Gatherer,,intelligence-gatherer,"ContextualBot is a web crawler operated by Mobian that gathers intelligence and contextual information from websites. This bot is categorized as an intelligence gatherer, likely collecting data for bu",2026-04-19T23:10:25.624+00:00
Contxbot,contxbot,https://knownagents.com/agents/contxbot,Intelligence Gatherer,,intelligence-gatherer,contxbot is Amazon's web crawler that processes and indexes webpage content to understand website topics and context for delivering relevant advertisements through Amazon's advertising network.,2026-04-19T23:10:25.624+00:00
Criteobot,criteobot,https://knownagents.com/agents/criteobot,Intelligence Gatherer,,intelligence-gatherer,CriteoBot is Criteo's web crawler that visits and analyzes web pages to understand content and user behavior patterns for serving personalized advertising campaigns.,2026-04-19T23:10:25.624+00:00
Cxensebot,cxensebot,https://knownagents.com/agents/cxensebot,Intelligence Gatherer,,intelligence-gatherer,"cXensebot is Cxense's web crawler that performs content indexing and behavioral data collection to power Piano's customer data platform, enabling real-time analytics and audience segmentation for digi",2026-04-19T23:10:25.624+00:00
Ds9,ds9,https://knownagents.com/agents/ds9,Intelligence Gatherer,,intelligence-gatherer,ds9 is operated by Copyright Clearance Center and crawls websites to gather information about published content for copyright licensing and rights management purposes. This bot helps identify and trac,2026-04-19T23:10:25.624+00:00
Dvbot,dvbot,https://knownagents.com/agents/dvbot,Intelligence Gatherer,,intelligence-gatherer,"DVbot is operated by DoubleVerify, a digital advertising verification company that monitors and measures media transactions across websites to ensure ad quality, detect fraud, and assess brand safety",2026-04-19T23:10:25.624+00:00
Echobot BOT,echobot-bot,https://knownagents.com/agents/echobot-bot,Intelligence Gatherer,,intelligence-gatherer,"Echobot Bot is an intelligence gatherer operated by Echobox. If you think this is incorrect or can provide additional detail about its purpose, please let us know.",2026-04-19T23:10:25.624+00:00
Ecovadissustainabilitybot,ecovadissustainabilitybot,https://knownagents.com/agents/ecovadissustainabilitybot,Intelligence Gatherer,,intelligence-gatherer,"EcoVadisSustainabilityBot is a web crawler operated by EcoVadis, a company that provides sustainability ratings and intelligence for businesses and their supply chains. The bot collects information on",2026-04-19T23:10:25.624+00:00
Rss Social,rss-social,https://knownagents.com/agents/rss-social,Fetcher,,fetcher,"RSS.Social is a fetcher bot that retrieves RSS feeds, likely as part of a service that automates social media posting or manages RSS content distribution.",2026-04-19T23:10:25.325+00:00
Rss2tg BOT,rss2tg-bot,https://knownagents.com/agents/rss2tg-bot,Fetcher,,fetcher,"rss2tg bot is an automated service that monitors RSS feeds and sends content updates to Telegram channels or users, enabling real-time notifications for feed content.",2026-04-19T23:10:25.325+00:00
Rssapi,rssapi,https://knownagents.com/agents/rssapi,Fetcher,,fetcher,"RSSAPI is a service that periodically monitors RSS, ATOM, and JSON feeds for customers, parsing and normalizing content, then delivering updates via webhooks in near real-time for feed subscription ap",2026-04-19T23:10:25.325+00:00
Scoopit Crawler,scoopit-crawler,https://knownagents.com/agents/scoopit-crawler,Fetcher,,fetcher,"scoopit-crawler is a web crawler operated by Scoop.it, a content curation platform that helps users discover, curate, and share content on various topics. The bot fetches and indexes relevant content",2026-04-19T23:10:25.325+00:00
Scour Ing,scour-ing,https://knownagents.com/agents/scour-ing,Fetcher,,fetcher,scour.ing is Scour's AI-powered web crawler that fetches content from RSS feeds and websites to create personalized content recommendations based on user interests.,2026-04-19T23:10:25.325+00:00
Scourrssbot,scourrssbot,https://knownagents.com/agents/scourrssbot,Fetcher,,fetcher,ScourRSSBot is a fetcher bot operated by Scour that retrieves RSS feed content from websites. The bot is likely used to collect and aggregate syndicated content for the Scour service.,2026-04-19T23:10:25.325+00:00
Serendeputybot,serendeputybot,https://knownagents.com/agents/serendeputybot,Fetcher,,fetcher,"serendeputybot is a fetcher operated by Serendeputy. If you think this is incorrect or can provide additional detail about its purpose, please let us know.",2026-04-19T23:10:25.325+00:00
Sfdc Callout,sfdc-callout,https://knownagents.com/agents/sfdc-callout,Fetcher,,fetcher,"SFDC-Callout is the user agent used by Salesforce when making HTTP callouts and API requests from Apex code, workflow rules, and other Salesforce automated processes to external services.",2026-04-19T23:10:25.325+00:00
Shortpixel,shortpixel,https://knownagents.com/agents/shortpixel,Fetcher,,fetcher,ShortPixel is a bot from an image optimization service that compresses and converts images to formats like WebP and AVIF. It visits websites to fetch and optimize images to reduce file sizes and impro,2026-04-19T23:10:25.325+00:00
Shortwave Image Fetcher,shortwave-image-fetcher,https://knownagents.com/agents/shortwave-image-fetcher,Fetcher,,fetcher,Shortwave Image Fetcher is a privacy-focused service that proxies images from HTML emails through Shortwave's servers to protect users' IP addresses and maintain email privacy when viewing content in,2026-04-19T23:10:25.325+00:00
Simplepie,simplepie,https://knownagents.com/agents/simplepie,Fetcher,,fetcher,"SimplePie is a fetcher operated by SimplePie. If you think this is incorrect or can provide additional detail about its purpose, please let us know.",2026-04-19T23:10:25.325+00:00
Skroutz Imagebot,skroutz-imagebot,https://knownagents.com/agents/skroutz-imagebot,Fetcher,,fetcher,"Skroutz ImageBot crawls and fetches product images from e-commerce websites to display in Skroutz's price comparison platform, enabling visual product browsing and comparison for Greek consumers.",2026-04-19T23:10:25.325+00:00
Skroutzbot,skroutzbot,https://knownagents.com/agents/skroutzbot,Fetcher,,fetcher,"SkroutzBot is a specialized web crawler used by Skroutz to download XML data feeds, product images, and sample product pages from merchant websites for quality control and product catalog management.",2026-04-19T23:10:25.325+00:00
Skype,skype,https://knownagents.com/agents/skype,Fetcher,,fetcher,"Skype is a fetcher operated by Skype. If you think this is incorrect or can provide additional detail about its purpose, please let us know.",2026-04-19T23:10:25.325+00:00
Skypeuripreview,skypeuripreview,https://knownagents.com/agents/skypeuripreview,Fetcher,,fetcher,"SkypeUriPreview is Skype's link preview bot that fetches page content when users share URLs in Skype messages, extracting metadata to display rich previews with titles, descriptions, and thumbnails.",2026-04-19T23:10:25.325+00:00
Slack Image Proxy,slack-image-proxy,https://knownagents.com/agents/slack-image-proxy,Fetcher,,fetcher,"Slack Image Proxy is a fetcher operated by Slack. If you think this is incorrect or can provide additional detail about its purpose, please let us know.",2026-04-19T23:10:25.325+00:00
Slack Imgproxy,slack-imgproxy,https://knownagents.com/agents/slack-imgproxy,Fetcher,,fetcher,"Slack-ImgProxy is a web crawler used by Slack to fetch, process, and cache images that are shared in Slack channels, ensuring they can be displayed properly within the messaging platform.",2026-04-19T23:10:25.325+00:00
Slackbot,slackbot,https://knownagents.com/agents/slackbot,Fetcher,,fetcher,"Slackbot is operated by Slack and is used to fetch link previews and unfurl content from websites when users share URLs in Slack conversations. When a link is posted, this bot retrieves metadata and i",2026-04-19T23:10:25.325+00:00
Slackbot Linkexpanding,slackbot-linkexpanding,https://knownagents.com/agents/slackbot-linkexpanding,Fetcher,,fetcher,"Slackbot-LinkExpanding is Slack's link unfurling bot that fetches web page content when users post links in channels, extracting meta tags like oEmbed, Twitter Cards, and Open Graph data to display ri",2026-04-19T23:10:25.325+00:00
Slackbotlinkexpanding,slackbotlinkexpanding,https://knownagents.com/agents/slackbotlinkexpanding,Fetcher,,fetcher,"SlackbotLinkExpanding is a fetcher operated by Slack. If you think this is incorrect or can provide additional detail about its purpose, please let us know.",2026-04-19T23:10:25.325+00:00
Snap URL Preview Service,snap-url-preview-service,https://knownagents.com/agents/snap-url-preview-service,Fetcher,,fetcher,"Snap URL Preview Service is a bot operated by Snap that fetches web page content to generate URL previews and rich link cards for links shared in Snapchat conversations. When users share links, this b",2026-04-19T23:10:25.325+00:00
Snapchat,snapchat,https://knownagents.com/agents/snapchat,Fetcher,,fetcher,"Snapchat is a fetcher operated by Snapchat. If you think this is incorrect or can provide additional detail about its purpose, please let us know.",2026-04-19T23:10:25.325+00:00
Sottopopnone,sottopopnone,https://knownagents.com/agents/sottopopnone,Fetcher,,fetcher,"SottopopNone is a web crawler operated by UpContent, a content curation and discovery platform that helps users find and share relevant content for their marketing and social media needs.",2026-04-19T23:10:25.325+00:00
Startmebot,startmebot,https://knownagents.com/agents/startmebot,Fetcher,,fetcher,"StartmeBot is a fetcher bot operated by Start.me, a personalized startpage and bookmarking service. The bot fetches content from websites to generate previews, thumbnails, and metadata for links that",2026-04-19T23:10:25.325+00:00
Statabot,statabot,https://knownagents.com/agents/statabot,Fetcher,,fetcher,Statabot is StataCorp's web crawler that searches for and indexes Stata statistical software table of contents files (stata.toc) for software package management.,2026-04-19T23:10:25.325+00:00
Steamchat,steamchat,https://knownagents.com/agents/steamchat,Fetcher,,fetcher,"SteamChat is Valve's web crawler that fetches URL previews and metadata for links shared within Steam's chat functionality, enabling rich link previews in conversations between Steam users.",2026-04-19T23:10:25.325+00:00
Substackcontentfetch,substackcontentfetch,https://knownagents.com/agents/substackcontentfetch,Fetcher,,fetcher,"SubstackContentFetch is a bot operated by Substack, a newsletter and subscription publishing platform. This bot fetches content from external websites to generate link previews, embed content, or aggr",2026-04-19T23:10:25.325+00:00
Superfeedr,superfeedr,https://knownagents.com/agents/superfeedr,Fetcher,,fetcher,"Superfeedr is a fetcher operated by Superfeedr. If you think this is incorrect or can provide additional detail about its purpose, please let us know.",2026-04-19T23:10:25.325+00:00
Superfeedr BOT,superfeedr-bot,https://knownagents.com/agents/superfeedr-bot,Fetcher,,fetcher,"Superfeedr bot is a feed fetching crawler operated by Superfeedr, a real-time RSS and feed API service. The bot retrieves and parses feeds on behalf of subscribers, providing push notifications for ne",2026-04-19T23:10:25.461+00:00
Surdotlybot,surdotlybot,https://knownagents.com/agents/surdotlybot,Fetcher,,fetcher,"SurdotlyBot is the web crawler for Sur.ly, a content preview and link shortening service. This bot fetches content to generate previews and thumbnails for links shared through the Sur.ly platform.",2026-04-19T23:10:25.461+00:00
Synapse,synapse,https://knownagents.com/agents/synapse,Fetcher,,fetcher,"Synapse is a fetcher operated by Matrix. If you think this is incorrect or can provide additional detail about its purpose, please let us know.",2026-04-19T23:10:25.461+00:00
Telegram BOT,telegram-bot,https://knownagents.com/agents/telegram-bot,Fetcher,,fetcher,"Telegram Bot is a fetcher operated by Telegram. If you think this is incorrect or can provide additional detail about its purpose, please let us know.",2026-04-19T23:10:25.461+00:00
Telegrambot,telegrambot,https://knownagents.com/agents/telegrambot,Fetcher,,fetcher,"TelegramBot is Telegram's web crawler that fetches webpage content to generate Instant View pages and link previews for users, enabling rich content display directly within the messaging app.",2026-04-19T23:10:25.461+00:00
Tiktokspider,tiktokspider,https://knownagents.com/agents/tiktokspider,Fetcher,,fetcher,TikTokSpider is a web crawler operated by TikTok that fetches content from websites when users share external URLs on the platform. The bot collects information for link previews and helps TikTok disp,2026-04-19T23:10:25.461+00:00
Tiny Tiny Rss,tiny-tiny-rss,https://knownagents.com/agents/tiny-tiny-rss,Fetcher,,fetcher,"Tiny Tiny RSS is a fetcher operated by Tiny Tiny RSS. If you think this is incorrect or can provide additional detail about its purpose, please let us know.",2026-04-19T23:10:25.461+00:00
Tumblr,tumblr,https://knownagents.com/agents/tumblr,Fetcher,,fetcher,"Tumblr is Automattic's link unfurling bot that fetches URL content to create rich Link Blocks in Tumblr posts, parsing responses to display titles, descriptions, and preview images for shared links.",2026-04-19T23:10:25.461+00:00
Twitterbot,twitterbot,https://knownagents.com/agents/twitterbot,Fetcher,,fetcher,"Twitterbot crawls web pages to generate Twitter Cards, fetching metadata like titles, descriptions, and images for link previews when URLs are shared on X (formerly Twitter).",2026-04-19T23:10:25.461+00:00
Upday,upday,https://knownagents.com/agents/upday,Fetcher,,fetcher,"upday crawls news websites and sources to aggregate articles for its news app platform, collecting and indexing content to provide personalized news recommendations.",2026-04-19T23:10:25.461+00:00
Viber,viber,https://knownagents.com/agents/viber,Fetcher,,fetcher,"Viber is a fetcher operated by Viber. If you think this is incorrect or can provide additional detail about its purpose, please let us know.",2026-04-19T23:10:25.461+00:00
Videootvbot,videootvbot,https://knownagents.com/agents/videootvbot,Fetcher,,fetcher,"videootvBot is a crawler that extracts the newest articles from publisher websites via feeds or HTML parsing to create carousels with images, links and text for native ads modules to improve content r",2026-04-19T23:10:25.461+00:00
Vkshare,vkshare,https://knownagents.com/agents/vkshare,Fetcher,,fetcher,"vkShare is a fetcher bot operated by VK, a social networking platform. It visits web pages when users share links on the VK network to collect preview information such as titles, descriptions, images,",2026-04-19T23:10:25.461+00:00
Whatsapp,whatsapp,https://knownagents.com/agents/whatsapp,Fetcher,,fetcher,"WhatsApp is a fetcher operated by Meta. If you think this is incorrect or can provide additional detail about its purpose, please let us know.",2026-04-19T23:10:25.461+00:00
